paper_name,keywords_name,publishing_date,abstract,abstract2
"
			Development of Augmented Reality Application for Learning Computer Network Device
					",",											Augmented Reality, 											3D, 											Computer Networking Devices, 											System Usability Scale									,","2021-06-18,",,",					,,,					Applied augmented reality works by detecting imageries or pictures, normally called markers, by using smartphone camera that detects these preplaced markers. Augmented reality has seen wide application in various fields, one of them is education. In the field of education, augmented reality is utilized to make learning process more engaging and attractive. Starting from the problem that learning computer networks on introduce to network device which is currently still delivered conventionally. So, this research makes a solution to this problem by developing learning media using augmented reality (AR) technology, which is a technology that combines two-dimensional or three-dimensional virtual objects into a real environment and then projects these virtual objects in real time. The purpose of this research is to build AR-based applications in learning computer network devices in order to increase understanding, generate motivation and student interest. The methodology used in this research consist of Envisioning Phase(Problem Identification, Planning Phase(Planning), Developing Phase(Design), Stabilizing Phase(Testing), Deploying Phase(Implementation). This study uses 31 students as sample and the data was analyzed using the SUS(System Usability Scale). The result show evaluates the usability using SUS of 31 respondents and it can be concluded that this AR application can be accepted by these students in its use with SUS Score obtained was 78.5,,				,"
"
			Fog Computing Based on Machine Learning: A Review
					",",											Fog Computing, 											Machine Learning, 											IoT, 											Optimization									,","2021-06-18,","Internet of Things (IoT) systems usually produce massive amounts of data, while the number of devices connected to the internet might reach billions by now. Sending all this data over the internet will overhead the cloud and consume bandwidth. Fog computing's (FC) promising technology can solve the issue of computing and networking bottlenecks in large-scale IoT applications. This technology complements the cloud computing by providing processing power and storage to the edge of the network. However, it still suffers from performance and security issues. Thus, machine learning (ML) attracts attention for enabling FC to settle its issues. Lately, there has been a growing trend in utilizing ML to improve FC applications, like resource management, security, lessen latency and power usage. Also, intelligent FC was studied to address issues in industry 4.0, bioinformatics, blockchain and vehicular communication system. Due to the ML vital role in the FC paradigm, this work will shed light on recent studies utilized ML in a FC environment. Background knowledge about ML and FC also presented. This paper categorized the surveyed studies into three groups according to the aim of ML implementation. These studies were thoroughly reviewed and compared using sum-up tables. The results showed that not all studies used the same performance metric except those worked on security issues. In conclusion, the simulations of proposed ML models are not sufficient due to the heterogeneous nature of the FC paradigm.,",",					,,,					,,,				,"
"
			MODEL-Based Performance Quality Assessment for IoT Applications
					",",											internet of things, 											IoT, 											prediction, 											MBT, 											quality assurance, 											performance prediction.									,","2021-06-18,","The number of applications incorporating Internet of Things (IoT) concepts increases extraordinarily. This increase cannot continue without high-quality assurance. There are some difficulties in testing IoT applications; the system heterogeneity, test cost and time are taken to test the system, and the precision percentage of test results.,,A well-known and possibly the best solution to overcoming these difficulties is to model the system for evaluation purposes, known as model-based testing (MBT). This paper aims to design a model-based testing approach to assess IoT applications performance quality attributes. The ISO 25000 quality model is used as a standard for software quality assurance applications. IoTMaaS is used as a case study to implement the methodological approach. The possible test cases were generated using the ACTS combinatorial test generation tool. The performance metrics of each test case were monitored until the optimum test case was identified, with the shortest response time and the least amount of resources used. The proposed testing method appears to be successful, according to the results.,",",					,,,					,,,				,"
"
			Blended Learning Model with IoT-based by Smartphone
					",",											Blended Learning, 											IoT-based Technology, 											Graduate Students, 											Smartphone, 											Mobile application.									,","2021-06-04,","In 2021, the COVID-19 pandemic is still not over. Thailand is the one that is facing the second wave of new coronavirus. Schools and universities were closed, and faculties need to mostly teach with Online pedagogy, including the graduate students' courses. This study proposes to focus on the Ubiquitous area of the Blended Learning model with IoT-based to solve a problem of graduate students and their advisors by the qualitative focus-group technique. The mobile application draft was synthesized and designed to track and monitor graduate students' research activities on smartphones by built-in sensors. They should stay active along while researching the advisor’s assignments on their smartphone. Non-active periods are implied when several behaviors are detected. Virtualize dashboards are processed to report the total active learning period of students for the advisor's evaluation.,,Moreover, students can continually monitor their self-efficacy to improve the online learning process. Besides, this study proposes to confirm the model’s quality by twelve experts with the questionnaire. The results show average scores of Propriety, Utility, Feasibility, and Accuracy standard are 4.32, 4.41, 4.37, and 4.21, respectively. Therefore, the Blended Learning model's overall qualities with IoT-based smartphones are extremely high and proper to implement.,",",					,,,					,,,				,"
"
			A Software Security Optimization Architecture (SoSOA) and its Adaptation for Mobile Applications
					",",											Reverse engineering, 											Security architecture, 											Security optimization, 											Software protection, 											Source code protection									,","2021-06-04,",,",					,,,					Security attacks become daily news due to an exposure of a security threat in a widely used software. Taking software security into consideration during the analysis, design, and implementation phases is a must. A software application should be protected against any security threat such as unauthorized distribution or code retrieval. Due to the lack of applying a software security standard architecture, developers may create software that may be vulnerable to many types of security threats. This paper begins by reviewing different types of known software security threats and their countermeasure mechanisms. Then, it proposes a new security optimization architecture for software applications. This architecture is a step towards establishing a standard to guarantee the software's security. Furthermore, it proposes an adapted software security optimization architecture for mobile applications. Besides, it presents an algorithmic implementation of the newly proposed architecture, then it proves its security. Moreover, it builds a secure mobile application based on the newly proposed architecture.,,				,"
"
			Success and Failure Aspects of LMS in E-Learning Systems
					",",											E-learning, 											Learning Management System (LMS), 											Course Management System (CMS), 											Online Learning, 											Emerging Technologies, 											Learning Outcomes, 											e-Assessment, 											Student Engagement.									,","2021-06-04,","Learning management systems (LMS) and their associated,,tools have created value for higher education institutions worldwide,,by improving content deliverability, accessibility, and retrievability.,,Nevertheless, many studies have criticised these systems for their,,teacher-centred approaches, which limit opportunities for social and informal,,learning. After several decades of institutions using LMS, this research,,aims to discuss the success and failure aspects of these LMS from,,various perspectives, including structure, content, and support for emerging,,technologies. Based on a thematic literature review and analysis, success,,and failure aspects are organised and verified by LMS experts.,,Alongside the aspects identified from the literature, these experts also,,noted several additional aspects of success and failure in LMS. The analysis,,results overall indicated the success aspects of LMS relate to seven,,key factors: single sign-on, learning management, content management,,,integration, security, tracking, and group management. Similarly, the,,failure aspects could be classified into eight factors: content creation and,,sharing, communicative features, structure, learning engagement, assessment,,,user interfaces, social and informal learning, and mobile features.,,The implications of the research for education institutions, instructors,,,developers, and system providers, as well as the resulting directions for,,future research, are thus also discussed to help increasing the chances of,,developing additional theoretical and practical insights.,",",					,,,					,,,				,"
"
			The Effect of Integrating an Educational Robot with Hypermedia on Students’ Acquisition of Scientific Concepts: The Case of Fifth-Grade Students
					",",											robot, 											hypermedia, 											scientific concepts, 											science, 											instruction									,","2021-06-04,","This study was designed to reveal the effectiveness of integrating educational robots (ERs) with hypermedia in improving the acquisition of scientific concepts among fifth-grade students in Jordan. The present study utilized a pretest-posttest quasi-experimental design with a control group (CG) and an experimental group (EG). The participants of this study consisted of 50 fifth-grade female students attending a private school in the city of Amman during the 2019/2020 academic year. Participants’ ages ranged between (10-11) years old. The school was selected purposively, and classes were randomly assigned to the EG and the CG. In order to accomplish the aims of this study, a scientific concept test (SCT) was developed and its validity and reliability were ensured. The EG was taught a unit on motion and force by robot and hypermedia instruction, while the CG was taught the same unit by traditional instruction. Data was collected through administration of the presently developed SCT at pretest and posttest points. Then, this data was analyzed through covariance analysis. The findings of this analysis revealed that 66% of the variation in the fifth-grade students’ posttest SCT scores can be ascribed to the effect of teaching method. From this study, one can conclude that the integration of ERs with hypermedia has a positive impact on students’ acquisition of scientific concepts. These results may serve to encourage science teachers to integrate ERs with hypermedia when teaching scientific concepts.,",",					,,,					,,,				,"
"
			The Role of Social Networks in the Organization of the Educational Process and Learning
					",,"2021-06-04,","The objectives of the study are to conduct a survey among students and teachers of Russian universities, which will determine their general attitude to the use of social networks in education; to identify the functions of social networks from the perspective of respondents; based on the results of both stages of the study, to determine the role of social networks in the educational process. Students and teachers of four Russian universities (MGIMO University, Kuban State Technological University, North-Eastern Federal University, Russian State Social University) took part in the survey. A total of 500 students and 100 teachers were interviewed. The results of the first part of the study showed that the attitude of students and teachers towards the use of social networks in education is generally positive. Both groups of respondents noted the advantages of introducing social networks into the educational process and also stated their willingness to increase their use. When using social networks in education, students can fill in special forms to indicate social network accounts to be subsequently used. Also, the administration of group chats can be taken under the control of the university for the purpose of a more structured exchange of information/educational materials.,",",					,,,					,,,				,"
"
			The Impact of Blended Learning using the Ideas Box on the Motivation for Learning Among Non-formal Syrian Female Refugee Students in Jordan
					",",											blended learning, 											Ideas Box, 											motivation toward learning, 											non-formal educa-tion, 											Culture Promotion Program for Dropouts									,","2021-06-04,",,",					,,,					The study aims to identify the impact of blended learning using the Ideas Box on the motivation toward learning among non-formal education female students in the Syrian refugee camps in Jordan. A semi-experimental approach was adopted; the sample of the study consisted of 30 female students enrolled in the Culture Promotion Program for Dropouts, second cycle, in the JOHUD Center for Social Support in January 2020. The experimental group consisted of 15 students who were taught the Islamic Pillars unit using the Ideas Box while the control group consisted of 15 students taught the same unit using the traditional way. Results show that there were no significant differences in mean scores of motivation between the two groups. This finding stresses the need for redesigning the current program used to teach students receiving the non-formal education to incorporate the Ideas Box into the curriculum.,,				,"
"
			Web-Based Animation Video for Student Environmental Education at Elementary Schools
					",",											Web-based animation video, 											environmental education, 											environmental awareness									,","2021-06-04,","This research and development aim at knowing the effectiveness of web-based animation videos application on environmental education of elementary school students in East Jakarta in Indonesia. Web-based animation videos for environmental education produced consisted of climate change, mangrove forest, waste recycling, biodiversity, and ozone depletion animation video pages.  Student environmental education measured was related to satisfying student natural curiosity, enhancing environmental awareness, and strengthening student pro-conservation values.  In the conclusion, it is highlighted that there is a positive effect of web-based animation videos application on student environmental education at elementary school students in Jakarta in Indonesia,",",					,,,					,,,				,"
"
			eDify: Enhancing Teaching and Learning Process by Using Video Streaming Server
					",",											Mobile Applications, 											Mobile Learning, 											Mobile Multimedia, 											Streaming Media, 											Usability, 											Video Streaming Server									,","2021-06-04,",,",					,,,					The study investigates the nature and degree of influence of the range of application usability variables on the learning experience of the students at a specific institution of higher education institution in Oman. The study was carried out via eDify implementation encompassing the usability variables and learning experience of the students. Literature does little to suggest the aforementioned relationship in the context of the Omani higher education. The current study would reveal the variables that are critical to effective technology-based learning of the students. The implications generated through the study would allow the institution involved in the study to effectively implement the variables required for enhanced teaching and learning. The methodology used in the study is divided into an exploratory and the main research. Principal component analysis and a range of regression analyses are conducted to test the relationships between the independent and the dependent variable, “learning experience”. Results suggest that the usability variables have both positive and significant effects on the dependent variable of the learning experience. One usability variable that stands out more than others is the usage of mobile media.,,				,"
"
			Flashover Prevention System using IoT and Machine Learning for Transmission and Distribution Lines
					",",											Flashover, 											Smart grid, 											Transmission and distribution line, 											IoT									,","2021-06-04,",,",					,,,					Flashover on transmission and distribution line insulators occurs when the insulator’s resistance drops to a critical level and causes frequent power outages. Thin layers of dust, salt, and airborne particles, gradually deposited on the surface of insulators, as well as humidity, form an electrolyte which causes flashover.  In this paper, a flashover prevention system using IoT technology and machine learning is proposed in order to reduce loss and increase power reliability. The system includes an IoT module, a service and clients. The IoT module prototype was installed at a distribution line pole located in Pracha-utit, Bangkok, Thailand and had collected data for thirty-four months. The data were pre-processed and split for the training process and evaluation. In this study, we built and compared four models including linear regression, polynomial regression, Auto-regressive Integrated Moving Average (ARIMA) and Long Short-Term Memory (LSTM) models. The results revealed that the LSTM model outperformed (,,=.931, RMSE= 530.74) the others.,,				,"
"
			Mobile Augmented Reality for Campus Visualization Using Markerless Tracking in an Indonesian Private University
					",",											Augmented Reality, 											Structure Visualization, 											Markerless Tracking									,","2021-06-04,","Marker in augmented reality plays a major part to initiate a virtual object in an augmented environment. Choosing a correct and reliable marker would increase the chance of creating a more stable augmented object especially for visualizing a building structure. Unfortunately, most research on visualizing building structure uses a marker-based tracking approach where users must always bring a pre-printed paper as a tracking media. This creates a problem for every time users demonstrate a specific augmented structure object, they still need to bring a printed marker to show the augmented object. The purpose of this research is to investigate the applicability of markerless-based tracking as a solution whether it can substitute the marker-based tracking on augmented reality problems. Simultaneous Localization and Mapping (SLAM) is used as a markerless tracking method where it tracked and mapped the surface environment using feature extraction, then set an anchor at the specified location where the augmented object visualization appears. The results of the research found that from a total of 30 object detection tests, 21 objects are successfully detected and 9 undetected objects, this shows that markerless-based tracking is applicable and can substitute marker-based tracking for a structural campus visualization.,",",					,,,					,,,				,"
"
			Human-Computer Interaction Perspective on Mobile Learning: Gender and Social Implications
					",",											Human Computer Interaction, 											Mobile learning, 											Gender Differences, 											Higher Education									,","2021-06-04,","The state of Kuwait has implemented a national e-learning initiative that included the distribution of mobile devices (Tablets) to be used by students and educators. Understanding the obstacles which currently prevent a successful roll-out, implementation, and adoption of mobile learning methods in Kuwait is vital. The opportunities for learners are particularly essential in this respect, and an absence of research remains an issue as far as Kuwait is concerned. This research was carried out within Kuwait Higher Education (HE) facilities to assess students' opinions and motivations for adopting this form of learning, aiming to analyse its efficacy and explore the social factors and gender issues that might impact extending mobile learning (m-learning) potential throughout Kuwait. A questionnaire has been central to this research, sent out to 620 students in total. Two statistical methods, an analysis of variance (ANOVA), and an independent-sample t-test, have been applied. The latter is essential for assessing if any statistical significance exists between two unrelated groups (male and female being the two independent variables). The results reveal disparities of age and gender while highlighting certain social and cultural factors that might prove to be obstacles that m-learning will need to overcome. A firm analysis of such issues will enable improved approaches to help learners' access and make the most robust m-learning methods.,",",					,,,					,,,				,"
"
			Modified Multipath Routing Protocol Applied On Ns3 Dcell Network Simulation System
					",",											communication networks, 											multipath routing protocol, 											DCell network simulation, 											data transmission, 											NS-3 program, 											link failure, 											rack problem									,","2021-05-25,","In the communication networks, guidance has become an important factor, with a significant impact on network performance, where the network orientation area has been and continues to be an ongoing development, intensive research for many years aimed at optimizing the network. This paper performs three modifications for a multipath routing protocol to solve the problem of routing in a DCell network simulation and apply online solutions on the network, the goal is to improve the transition efficiency of data. The modifications used to avoid data transmission failures which are delay problem,,link failure problem, and power off (rack problem). The implementation of multipath routing protocol on the DCell network in actual simulation using the NS-3 program, which represents the rule that the DCell network was built and simulated. Finally, the modifications succeeded and return good results decreasing the delay time and solving the data transaction problems.,",",					,,,					,,,				,"
"
			Mobile-Assisted Writing Instruction: Affordances, Challenges, and Future Directions
					",,"2021-05-25,","Mobile-assisted language learning (MALL) is popular worldwide. One related issue under discussion is how to effectively harness mobile devices to help English writers. This paper first unpacks writing as a meaning making process from the perspective of systemic functional linguistics. It then summarizes the major MALL-based studies on writing instruction, including the affordances and challenges of MALL-based writing instruction. This paper then discusses how to address challenges as identified in the existing studies on MALL-based writing instruction, centering on writing as a meaning making process. The paper ends with pedagogical tips for educators who are interested in using mobile technology to comprehensively improve students’ English writing construction across different contexts.,",",					,,,					,,,				,"
"
			Towards an Efficient Integrated Distance and Blended Learning Model: How to Minimize the Impact of COVID-19 on Education
					",",											Distance learning, 											COVID-19 Pandemic, 											e-learning, 											Perceptions, 											Modeling, 											Competency									,","2021-05-25,","As governments and international bodies worldwide sought to prevent the spread of Covid-19, underdeveloped countries have been particularly challenged as they have little or no technological models and frameworks in place and the literature offers little guidance. The current research applied a quantitative approach to researching educational practitioners’ perceptions of e-learning acceptance, using a sample of 4,024 educators and students from a range of Kuwaiti educational institutions. Findings indicate that respondents were slightly supportive of e-learning adoption, with a majority acknowledging its advantages. However, respondents also mention the need for development in the technological competencies required to operate the proposed e-learning programs and a range of challenges that may impact e-learning. Hence, the authors propose a distance and blended learning model (DBLM) to enhance the implementation, utilisation, and evaluation of e-learning within the Kuwaiti educational system. Also, an e-learning teacher capability maturity model (eTCMM) was proposed to foster educators’ competencies and enable their active use of e-learning platforms. ,",",					,,,					,,,				,"
