paper_name,keywords_name,publishing_date,abstract,abstract2
"
			Study and Simulation of Transporting Radio Frequency Signals over Free Space Optics for Achieving High Data Rate and Power Saving
					",",											Free Space Optics, 											Radio Frequency, 											Amplitude shift keying, 											Quadrature ampli-tude modulation, 											Quadrature phase shift keying, 											Wavelength Division Multiplex-ing, 											Power Management									,","2021-08-23,",,",					,,,					The remarkable technology for seamless integration of wireless and optical networks is radio frequency signals over Free Space Optics (FSO). This research study and simulation examine the design and evaluation performance of Radio Frequency over FSO (RF-FSO) wireless communication technology. These systems are implemented through medium communication link ranges to overcome excessive sensitivity of atmosphere medium and meet the requirements of a wide variety of optical wireless applications. There are two ways to achieve the application of the design mentioned above. The first way is the application of the  Three modulation schemes of technology that is Amplitude shift keying (ASK), Quadrature amplitude modulation (QAM), and Quadrature phase-shift keying (QPSK) of digital modulation. The design of these modulation schemes is realized by using optiwave software to study the transmission of RF signals over the FSO channel and compare the three modulation techniques into the RF-FSO system. RF signals with the frequency range from (20 to 60) GHz is used in RF-FSO system and many carrier optical signals where the higher RF has a wider bandwidth to carrying larger information. To increase the transmission of data rates Wavelength Division Multiplexing (WDM) technology is used. The second way is based on a mathematical model which has been proposed for this study. This mathematical model calculates optimal beacon period (BI), and optimal listen interval (LI) to preventing the overlapping of time between the signals and the decrease in the required power. Using different weather conditions samples, the simulation results revealed that the best performance of the RF-FSO system is from link range, and the receiver is more sensitive. The simulation results are as follows: Two independent channels are transmitted 20 Gbps over ranges from (263 m to 6.55 km), while four channels are transmitted 40 Gbps over ranges from (257 m to 5.95 km), and eight independent channels transmit 80 Gbps over distance from (203 m to 5.2 km),,				,"
"
			A New Block Cipher Algorithm Using Magic Square of Order Five and Galois Field Arithmetic with Dynamic Size Block
					",",											Cryptography, 											GF(28), 											GF(P), 											Magic Square, 											Multi-level key.									,","2021-08-23,","This paper describes the development of encryption algorithms using the magic square of order 5 and Multi-level keys with the addition of Matrix keys to increase implementation speed and complexity. This work relied mainly on the magic sum and some equations that were added as an improvement on previous work. Multi-level keys were used for three different message sizes, and an additional key matrix with size 5×5 was used to add more complexity. The proposed work was performed using both GF(P) and GF(2,,). Results were compared with the MS3, they have been found good, with acceptable speed and high complexity where it was (P),, × (256),, in the first algorithm, (P),, × (256),, × 3 in the second algorithm, and (P),, × (256),, × 3 × (P),, in the third algorithm, the complexity changed according to the chosen value of N randomness, in addition to speed, complexity, NIST calculations have been performed for texts and histogram calculations for different images were calculated and compared as well.,",",					,,,					,,,				,"
"
			Intelligent Security Schema for SMS Spam Message Based on Machine Learning Algorithms
					",",											security, 											protection, 											Internet, 											SMS spam, 											intrusion detection, 											attacks.									,","2021-08-23,","SMS spam messages represent one of the most serious threats to current traditional networks. These messages have been particularly prevalent overseas and are harmful to various types of devices. The current filtering scheme employed in conventional systems is unable to expose a large number of messages. To resolve this issue, a new intelligent security system is proposed to reduce the number of spam messages. It can detect novel spam messages that have a direct and negative impact on networks. The proposed system is heavily based on machine learning to explore various types of messages. The primary achievement of our study is the increase in the accuracy ratio as well as the reduction in the number of false alarms. According to the experimental results, it is clear that our system can realize outstanding results, detecting a massive number of massages.,",",					,,,					,,,				,"
"
			Mobile Application to Detect Covid-19 Pandemic by Using Classification Techniques: Proposed System
					",",											COVID-19, 											Fuzzy C-Mean (FCM), 											Propagation (BP) classification, 											Information Gain (IG), 											Mobil Application									,","2021-08-23,","Various mobile applications such as Mobile Health (mHealth) have been developed and spread across the world which has played an important role in mitigating the Coronavirus pandemic (COVID-19). As the COVID-19 pandemic spreads, several people have drawn parallels to influenza. While both viruses cause respiratory infections, they propagate in very different ways. This has a major impact on the public health measures that can be used to fight each virus. These viruses are pandemic-causing in the same way. That is, they both cause respiratory disease, and can present themselves in several ways, ranging from asymptomatic to severe and deadly. A proposal is presented in this paper that uses two algorithms to define and classify these pandemics, they are: The Back Propagation (BP) classification algorithm and the Fuzzy C-Mean (FCM) clustering algorithm. Two stages are implemented in the proposed system: in the first step, the FCM algorithm is used to find out the type of virus, and this algorithm is capable of handling ambiguous features of viruses. In the second step, a BP neural network is used as a classifier to detect the pandemic class. The proposed system was trained and tested using a well-known dataset (covid-19 vs influenza). Information Gain (IG) is used to optimize the related features that affect the classification process to improve speed and accuracy.  The proposed mobile application is developed to support users easily detecting the COVID-19 infection by inputting the medical tests as significant features to the proposed system. The proposed system's accuracy is up to (89%), the framework was created using the Matlab programming environment and an Android Studio for Mobil application designing.,",",					,,,					,,,				,"
"
			The Development of POTENSIA; The Android-Based Psychological Application for Mapping and Assessments of Student Mental Health During the COVID-19 Pandemic
					",",											Android-based applocation, 											mental health, 											college student, 											COVID-19 pandemic									,","2021-08-23,",,",					,,,					Students experience various essential changes related to their psychological conditions during their education in college. Students' adaptability to the demands of these changes will give birth to new skills for the next stage of psychological development. However, academic stress, social problems, career, and personal-emotional problems can hinder the productivity and development of students in terms of mental health. This issue increased with the new-normal life during the COVID-19 pandemic, which also impacted the education process. For this reason, it is necessary to have a mobile-based online psychological assessment to map the mental health conditions of students during the pandemic. This study aims to develop and validate an Android-based online psychological assessment application to map students' mental health conditions. This study involved ten experts in counseling and software development, five counselors, and 638 users of the POTENSIA application. According to application development needs, data analysis using Aiken's V coefficient test, Confirmatory Factor Analysis (CFA), and Rasch Model Analysis. The results of the study prove that the application is considered valid and practical to use. The effectiveness of the application is considered very good in mapping the mental health conditions of students.,,				,"
"
			Intelligent Mobile Coronavirus Recognition Centre Based on IEEE 802.15.4
					",",											Artificial intelligence, 											COVID-19, 											Decision tree algorithm, 											Detection system.									,","2021-08-23,","The novel coronavirus (COVID-19) has become widespread around the world. It started in Wuhan, China, and has since spread rapidly among people living in other countries. Hence, the World Health Organization has considered COVID-19 as a pandemic that threatens millions of people’s lives. Due to the high number of infected people, many hospitals have been facing critical issues in providing the required medical services. For instance, some clinical centers have been unable to provide one of the most important medical services, namely blood tests to determine whether an individual is infected with COVID-19. Therefore, it is important to present an alternative diagnosis option to prevent the further spread of COVID-19. In this paper, a proposed intelligent detection communication system (IDCS) is configured for distributed mobile clinical centers to control the pandemic. In addition, the intelligent system is integrated with the Zigbee communication protocol to build a mobile COVID-19 detection system. The proposed system was trained on X-ray COVID-19 lung images used to identify infected people. The Zigbee protocol and decision tree algorithm were used to design the IDCS. The results of the proposed system show high accuracy 94.69% and accept results according to the performance measurements.,",",					,,,					,,,				,"
"
			The Challenges and Prerequisites of Data Stream Processing in Fog Environment for Digital Twin in Smart Industry
					",,"2021-08-11,","Smart industry systems are based on integrating historical and current data from sensors with physical and digital systems to control product states. For example, Digital Twin (DT) system predicts the future state of physical assets using live simulation and controls the current state through real-time feedback. These systems rely on the ability to process big data stream to provide real-time responses. For, example it is estimated that one autonomous vehicle (AV) could produce 30 terabytes of data per day. AV will not be on the road before using an effective way to managing its big data and solve latency challenges. Cloud computing failed in the latency challenge, while Fog computing addresses it by moving parts of the computations from the Cloud to the edge of the network near the asset to reduce the latency. This work studies the challenges in data stream processing for DT in a fog environment. The challenges include fog architecture, the necessity of loosely-coupling design, the used virtual machine versus container, the stateful versus stateless operations, the stream processing tools, and live migration between fog nodes. The work also proposes a fog computing architecture and provides a vision of the prerequisites to meet the challenges.,",",					,,,					,,,				,"
"
			Survey on 3D Content Encryption
					",",											3D Content, 											Chaotic system, 											3D model.									,","2021-08-11,","The rapidly growing 3D content exchange over the internet makes securing 3D content became a very important issue. The solution for this issue is to encrypting data of 3D content, which included two main parts texture map and 3D models. The standard encryption methods such as AES and DES are not a suitable solution for 3D applications due to the structure of 3D content, which must maintain dimensionality and spatial stability. So, these problems are overcome by using chaotic maps in cryptography, which provide confusion and diffusion by providing uncorrelated numbers and randomness. Various works have been applied in the field of 3D content-encryption based on the chaotic system. This survey will attempt to review the approaches and aspects of the structure used for 3D content encryption methods for different papers. It found the methods that used chaotic maps with large keyspace are more robust to various attacks than other methods that used encryption schemes without chaotic maps. The methods that encrypting texture, polygon, and vertices for 3D content provide full protection than another method that provides partial protection.,",",					,,,					,,,				,"
"
			3D Polygon Mesh Encryption Based on 3D Lorenz Chaotic Map
					",",											3D Polygon Mesh Model, 											vertices, 											3D Lorenz Chaotic map									,","2021-08-11,","The multimedia application developments in recent years lead to the widespread of 3D model applications. It becomes more popular in various fields as well as exchanging it over the internet. The security of the 3D models is a very important issue now a day, so the scheme for encrypting the 3D model will be proposed in this work. In this proposed scheme, the 3D polygon mesh model will be protected through the encrypting process based on a 3D Lorenz Chaotic map where the vertices value of the 3D polygon mesh model will be modified using 3D keys generated by 3D Lorenz Chaotic Map, which has excellent property and provides a good diffusion. The proposed scheme was implemented on various 3D models, which have a different number of vertices and faces. The experimental results show that the proposed scheme has good encryption results, which were noted through completely deforming and changing the whole shape of the 3D models. The Hausdorff Distance (HD) and histogram metrics are adopted to calculate the matching degree between the original and extracted model. The results show that the original and extracted model are identical through the values of HD, where they are approximately zero, and the histogram visually is identical.    ,",",					,,,					,,,				,"
"
			Exploiting Cloud Computing and Web Services to Achieve Data Consistency, Availability, and Partition Tolerance in the Large-Scale Pervasive Systems
					",",											CAP properties, 											cloud computing, 											data replication, 											distributed systems, 											pervasive information systems, 											web services									,","2021-08-11,",,",					,,,					This article presents a new comprehensive approach to realize a sufficient trade-off between the CAP properties (i.e., consistency, availability, and partition tolerance) in the large-scale pervasive information systems. To achieve these critical properties, the capabilities of both cloud computing and web services were exploited in developing the components of the proposed approach. These components include a cloud-based replication architecture for ensuring high data availability and achieving partition tolerance, a web services-based middleware for maintaining the eventual consistency, and a data caching scheme to enable the mobile computing elements to conduct  update transactions during the disconnection periods.  The evaluation of the performance aspects revealed that the proposed approach is able to achieve a load balance, lower propagation delay, and higher cache hit ratio, as compared to other baseline approaches.,,				,"
"
			Password Strength Metre Application
					",",											access control, 											authentication, 											password, 											password strength									,","2021-08-11,",,",					,,,					Passwords are considered the most commonly used method of authentication.  Unfortunately, weak passwords are known to be the main cause of many cyber attacks.  With stronger passwords, it is believed that this first line of defence would be able to reduce the risk of cyber attacks, trespass and information exposure.   A password strength metre application was, therefore, developed so that users can try out the passwords of their choice before actually deciding to register them.  Although the application contains such information as password entropy, password quality index and password complexity index, the data is presented in a user-friendly way so that it is intuitive to any users.,,				,"
"
			Examining Users’ Concerns while Using Mobile Learning Apps
					",",											mobile learning, 											mobile apps, 											sentiment analysis, 											topic modeling, 											user re-views									,","2021-08-11,","Mobile learning applications (apps) are increasingly and widely adopted for learning purposes and educational content delivery globally, especially with the massive means of accessing the internet done majorly on mobile handheld devices. Users often submit their feedback on use, experience and general satisfaction via the reviews and ratings given in the digital distribution platforms. With this massive information given through the reviews, it presents an opportunity to derives valuable insights which can be utilized for various reasons and by different stakeholders of these mobile learning apps. This large volume of online reviews creates significant information overload which presents a time-consuming task to read through all reviews. By combining text mining techniques of topic modeling using Latent Dirichlet Algorithm (LDA) and sentiment analysis using Linguistic Inquiry Word Count (LIWC), we analyze these user reviews. These techniques identify inherent topics in the reviews and identifies variables of user satisfaction of mobile learning apps. The thematic analysis done reveals different keywords which guide classification into the topics identified. Conclusively, the topics derived are important to app stakeholders for further modifications and evolution tasks.,",",					,,,					,,,				,"
"
			Influence of Design Elements of Mobile Push Notifications on Mobile App User Interactions
					",",											Push Notifications, 											Mobile Apps, 											Mobile Push Notifications, 											Design Elements, 											Cramer’s V									,","2021-08-11,","With the increasing relevance of mobile apps for companies, push notifications to address app users are also becoming more important. While the acceptance factors of push notifications have already been extensively researched, the effect of the different design elements on user interaction by opening the mobile app is still completely unexplored. Based on existing scientific findings from related fields, especially banner advertising and e-mail marketing, the authors first develop hypotheses on the effect of title, button and image on user interaction with push notifications. In several experiments the hypotheses are tested using the example of a mobile shopping app. The results are evaluated using Chi-square test and Cramer's V. While the use of a title seems to have a positive effect on interaction rates, the hypotheses on the positive effect of buttons and images on interaction rates have to be rejected.,",",					,,,					,,,				,"
"
			Using M-Learning Technology in Teaching Foreign Languages: A Panacea during COVID-19 Pandemic Era
					",",											Foreign Languages, 											English as a Foreign Language (EFL), 											Graduate Education, 											Mobile Assisted Language Learning (MALL), 											MALL technology, 											Mobile Learning (m-learning), 											Smartphone Application									,","2021-08-11,","The higher education system around the world is being rapidly developed towards digitalization – from computers to laptops, from laptops to tablets and smartphones. Accordingly, traditional delivery of instruction is being shifted towards blended learning that is being gradually replaced with distance learning, i.e. higher education is moving forward with mobile learning (m-learning) technologies. The introduction of mobile learning became the most topical event in 2020 in the context of the COVID-19 pandemic, due to which many countries had to completely move to distance learning in higher education. The purpose of the study is to analyze the prospects for the widespread use of mobile applications in teaching English as a foreign language (EFL) in Russia to Russian and Arab learners. In the course of the study, an online survey based on a questionnaire consisting of four open and closed questions was conducted. An empirical method was applied to collect the research data.  The survey was conducted at the Department of Foreign Languages of the Engineering Academy of the Peoples' Friendship University of Russia (EA PFUR). The total research sample included 200 participants and consisted of: 50 potential employers, 50 Russian and Arab students of the Peoples' Friendship University of Russia studying Linguistics (training program code 035700), 50 faculty members, namely teachers of the Peoples' Friendship University of Russia, the Institute of Foreign Languages of the Moscow State Pedagogical University and the Moscow Institute of Physics and Technology, as well as 50 administrative staff of the Peoples' Friendship University of Russia. The purpose of the survey was to collect information about the use of mobile applications (Smartphone Apps) and the introduction of mobile learning technology (m-learning) in the process of teaching EFL to students. According to the results of the survey, instructors are actively using mobile technologies in their professional activities and all participants in the learning process are receptive to their introduction in education. At the same time, respondents believe that technical challenges are the major obstacle to the adoption of mobile applications; these problems must be overcome in order to enable more productive use of mobile applications. In this regard, the study of mobile applications that are suitable for specific aspects of learning a foreign language, such as spoken language, reading comprehension, listening or writing, can be considered a promising research area.,",",					,,,					,,,				,"
"
			A Conceptual Framework to Aid Attribute Selection in Machine Learning Student Performance Prediction Models
					",",											Learning analytics, 											Student performance prediction, 											Academic analytics, 											Machine learning									,","2021-08-11,",,",					,,,					One of the important key applications of learning analytics is offering an opportunity to the institutions to track the student’s academic activities and provide them with real-time adaptive consultations if the student academic performance diverts towards the inadequate outcome. Still, numerous barriers exist while developing and implementing such kind of learning analytics applications. Machine learning algorithms emerge as useful tools to endorse learning analytics by building models capable of forecasting the final outcome of students based on their available attributes. The machine learning algorithm’s performance demotes with using the entire attributes and thus a vigilant selection of predicting attributes boosts the performance of the produced model. Though, several constructive techniques facilitate to identify the subset of productive attributes, however, the challenging task is to evaluate if the prediction attributes are meaningful, explicit, and controllable by the students. This paper reviews the existing literature to come up with the student’s attributes used in developing prediction models. We propose a conceptual framework which demonstrates the classification of attributes as either latent or dynamic. The latent attributes may appear significant but the student is not able to control these attribute, on the other hand, the student has command to restrain the dynamic attributes. Each of the major class is further categorized to present an opportunity to the researchers to pick constructive attributes for model development.,,				,"
"
			Developing an Android-Based City Tour App using Evolutionary Algorithm
					",",											Brute force, 											City tour, 											Genetic algorithm, 											Mobile application									,","2021-07-28,",,",					,,,					Traveling around a city and making transit in certain areas is called a city tour. Furthermore, determining the optimal city tour route can be considered as a traveling salesman problem. There are many kinds of algorithms to solve this, one of which is the Genetic Algorithm (GA). In developing the City Tour application, a platform is needed to be taken to various places anywhere and anytime. Finally, we developed an application that runs on mobile devices. This application is built on the Android platform so that its use can be more efficient. Furthermore, it can be concluded that the GA applied to the Android-based City Tour Application is reliable to determine city tour routes; this is evidenced by comparing GA with the brute force method, where GA provides optimum results with less running time.,,				,"
