paper_name,keywords_name,publishing_date,abstract,abstract2
"
			Projects Management in Technology Start-ups for Mobile Software Development
					",",											start-ups, 											software methodologies, 											business models, 											mobile software development									,","2021-04-09,",,",					,,,					The management of the technology start-up company for development of software for mobile devices includes various activities such as creation of specification, development, implementation, sale, and maintenance of software for mobile devices, as well as services for it. Usually the main activity is the production and maintenance of software for mobile devices, but there may be different options and sub-options in the business model of the technology start-up, which are divided into two main categories - products and services. In recent years, there has been a trend to move into a business with service providers. The objective of our study is to outline some specifics about the operation of technology start-up companies for mobile software development in areas such as the management of human and financial resources, choosing the suitable methodology for software development and business model to follow.,,				,"
"
			Mobile Applications for Developing Second Language Collaborative Writing
					",",											Mobile Assisted Language Learning, 											Collaborative Writing, 											Mobile Apps for collaborative writing tools									,","2021-04-09,","Developing writing skills in a foreign language is one of the demanding tasks for both teachers and students. It not only demands extensive reading and intensive practice in writing both inside and outside the classroom but also timely feedback and error-correction. The experimental study aimed at studying the impact of collaborative writing tasks using mobile applications like ,,, ,,, and ,, on enhancing the writing ability at the pre-intermediate level of Common European Frame of Reference (CEFR). The participants were tertiary level students of Cihan University who were randomly divided into two equal groups (n=28). One group used ,, and the other group used the ,, and ,, apps on their mobile devices. The comparative study analyzed the impact of each application on improving the writing skills of the students with pretest and posttest results and semi-structured interviews. The results indicated that the participants who used ,, and ,, apps have performed better than the participants in the ,, group. The results have implications for teachers teaching writing skills and students who write using mobile applications.,",",					,,,					,,,				,"
"
			Your MAC Address Can be Detected Easily When Your Smartphone Connected to the Wi-Fi
					",",											MAC layer data, 											Time-stamp, 											RSSI, 											Smartphone, 											Wi-Fi tracking system									,","2021-04-09,",,",					,,,					In this short paper, we prove that smartphones connected to Wi-Fi can be detected (scanned) easily with a Raspberry Pi help. According to the observation, the smartphone eventually broadcasts some packets of data containing MAC layers data. The period of broadcasting data depends on the smartphone’s state (active scanning/sleep). Besides MAC layers data, we also detect/capture other parameters, i.e., wireless signature data transmitted by smartphone (RSSI) and Time-stamp. The RSSI value measured in this test has a range from –30 dBm to –80 dBm. The result proves that different smartphones give different RSSI values (each smartphone emits different power strength). The RSSI value has more significant changes in a short-range (in this test result, 1 to 10 meters) and less significant change in a long-distance (above 20 meters). MAC address, time-stamp, and RSSI scanned/captured successfully through Raspberry Pi from the smartphones can be used as a reference for various purposes/applications in future work, such as Wi-Fi scanning/tracking system.,,				,"
"
			Effects of “the Selected Smartphone Social-Messaging Applications” Training on Iranian Elderly’s Quality of Life: Results of a Qualitative Study
					",",											Iranian elderly, 											Quality of life, 											Smartphone, 											Social applications, 											Semi-experimental qualitative method									,","2021-04-09,",,",					,,,					This qualitative study aimed to investigate the effects of using smartphone’s communication apps on Quality of Life (QoL) of elderly people living in Shiraz-Iran. The population of the study was all the senior residents registered with local public health centers located in Shiraz, Fars, Iran in 2018-2019. Overall, 20 participants volunteered to join the study, from the intervention and control groups (10 in each). Data were collected via semi-structured face to face interviews and analyzed using open-coding. The findings of this study and the educational training are intended to help families, practitioners in the aging field to pay more attention to teaching modern communication technology in order to promote healthier elderly and community.,,				,"
"
			Designing Cuckoo Based Pending Interest Table for CCN Networks
					",,"2021-04-09,","Content Centric Networking (CCN) is a modern architecture that got wide attention in the current researches as a substitutional for the current IP-based architecture. Many studies have been investigated on this novel architecture but only little of them focused on Pending Interest Table (PIT) which is very important component in every CCN router. PIT has fundamental role in packet processing in both upstream process (Interest packets) and downstream process (Data packets). PIT must be fast enough in order to not become an obstruction in the packet processing and also it must be big enough to save a lot of incoming information. In this paper, we suggest a new PIT design and implementation named CF-PIT for CCN router. Our PIT design depends on modifying and utilizing an approximate data structure called Cuckoo filter (CF). Cuckoo filter has ideal characteristics like: high insertion/query/deletion performance, acceptable storage demands and false positive probability which make it with our modification convenient for PIT implementation. The experimental results showed that our CF-PIT design has high performance in different side of views which make it very suitable to be implemented on CCN routers.,",",					,,,					,,,				,"
"
			Utilization of Various Disruptive Community Learning Resources for the Covid-19 Period in the Perspective of Life Based Learning
					",",											Community Learning Resources, 											Fields of Science, 											Life Based Learning									,","2021-04-09,",,",					,,,					This study aims (1) to analyze the use of various disruptive community learning resources during the Covid-19 period in terms of characteristics, levels, and types of learning resources used by lecturers in lectures, and (2) to find out the differences in the use of various disruptive community learning resources during the Covid-19 period between fields of science at Universitas Negeri Malang. The research approach used quantitative with an ex post facto design. The respondents of this research were 393 students of Universitas Negeri Malang from eight faculties. The data was collected through a closed questionnaire distributed through the Google Form application technology. Data analysis was performed by using percentage description statistics and different tests of the use of learning resources between the sciences, social humanities, and engineering. The results of the analysis show that (1) the characteristics, levels, and types of disruptive community learning resources in the Covid-19 era used by lecturers in lectures vary widely, (2) there are significant differences in the use of various disruptive community learning resources during the Covid-19 period between science and social humanities students, and engineering.,,				,"
"
			Development of E-Learning, Mobile Apps, Character Building, and Outdoor Study (EMCO Learning Model) to Improve Geography Outcomes in the 21st Century
					",",											Development, 											EMCO learning model, 											geography learning outcomes									,","2021-04-09,",,",					,,,					This development study aims to 1) create a learning model that fuses e-learning, a mobile app, character building, and outdoor study and 2) determine the effectiveness of the EMCO learning model on student learning outcomes. This study uses a research and development design with the model of Dick and Carey. A product feasibility test is performed by the learning, media, and materials expert validators, and the product’s effectiveness is tested by students. The data analysis includes descriptive statistics to determine the product feasibility and an independent sample t-test to determine the effectiveness of the learning model. The results of the expert validation show that the EMCO model is in the very good category and does not need revision. The EMCO model has a learning syntax with four phases: LKPD (student worksheet), assessment instrument, learning media, and teaching materials. Results indicate that the EMCO learning model is effective in improving geography learning outcomes. The model has the advantages of 1) effective and innovative material delivery; 2) easy-to-use navigation keys to access the material; 3) attractive design; 4) availability of CBT (computer-based test); and 5) online learning media that can be accessed anytime, anywhere, and under any conditions. The research has a positive impact on students and is able to transform them into 21,,-century learning agents.,,				,"
"
			Development Of Guided Discovery Based Electronic Module For Chemical Lessons In Redox Reaction Materials
					",",											Electronic Modules, 											Guided Discovery, 											Redox Reaction Materials									,","2021-04-09,",,",					,,,					This research is the development of guided discovery based electronic module that aims to know the eligibility level of e-modules and student responses to guided discovery-based electronic modules in redox reaction material. This electronic module uses the ADDIE development model. The research was conducted at one of the high schools in Bengkulu with the subject 9 students of X MIPA A Students for small scale trials and 30 students of X MIPA D Students for large scale trials. From the results of the research obtained (1) the percentage of the feasibility of e-modules on the material aspect is 86,315% while from the media aspect is 91.425% so that based on the results of validation by the E-module validator is declared very valid, (2) based on the test results of the small-scale student response percentage of 75.97 % with interesting category, while for large-scale trials of 84.48% with a very interesting category. From the results percentage, it can be concluded that e-module is suitable for use in learning. Electronic module based on guided discovery is an effective tool to help students in learning redox reaction subject. E-module can be accessed by smartphone or laptop. With this e-module, students can access the study material from everywhere without any time limitation.,,				,"
"
			Development of the Interactive Multimedia Software “Inquiry Play-Room” as an Electronic Learning Resource for Rotation and Equilibrium Topic
					",",											Equilibrium, 											inquiry, 											interactive multimedia, 											rotation									,","2021-04-09,",,",					,,,					This study reports the development of the interactive electronic multimedia “Inquiry Play-Room” for use in rotation and equilibrium topics. This was designed following the steps of a guided inquiry laboratory model, containing video problems, feedback, virtual laboratories, student worksheets, animations, practical applications, and quizzes. The tests are offered at two levels, one to grasp the concept and the second to be incorporated into actual life. This difference in learning can spur student confidence that will allow them to concentrate. The teacher can also enhance the content quality and patterns of movement through classes and online learning, as this technology is designed for face-to-face use. This interactive media is developed using the SWiSHMax framework and the ActionScript 2.0 programming language. The architecture of this media production model follows these steps: 1) analysis, 2) design, 3) development, 4) implementation, and 5) evaluation. At a 90.3 percent positive rate, the expert testing results indicate feasibility. The results of 27 students showed that the students responded positively to multimedia design. Therefore, the use of interactive multimedia was shown to be possible. The results of this study open avenues for digital creation in other fields of physics,,				,"
"
			Design and Development of IoT Based Water Flow Monitoring for Pico Hydro Power Plant
					",",											River flow, 											IoT, 											pico hydro power plant, 											rural electrification									,","2021-04-09,",,",					,,,					A Pico hydro power plant is one good solution to support energy independence for rural areas in Indonesia. The problem that normally emerged is the uncertainty of water debit. This may cause the damage of the Pico hydro power plant equipment. The main objective of this study is to design a water flow monitoring (WAFLOW-MT) device based on the Internet of Things (IoT). This device may help the technicians at the Pico hydro power plant in monitoring the speed of water flow at the river so that the water debit is recorded all the time. The design and development process of the WAFLOW-MT device was done through 4 stages: 1) need analysis; 2) system design; 3) system development, and 4) system testing. The data was collected from the water flow sensor and sent via IoT to the webserver thingspeak.com by 6 days duration of testing. According to the testing result, it can be concluded that the WAFLOW-MT device successfully monitored the water flow of the river.,,				,"
"
			Examining the Efficacy of a Novel Augmented Reality Mobile Delivery Platform for the Enhancement of Asthma Care Education for Children
					",",											Augmented reality (AR), 											MySpira, 											Asthma, 											Care Education for Children									,","2021-04-09,"," ,,MySpira is the world first augmented reality (AR) asthma inhaler training app; it enables children to learn asthma keywords, types of inhalers, the preparation of the inhaler and spacer, asthma triggers, and develop skills on how to use an asthma inhaler effectively. All of these are compiled into an enjoyable 20-minute experience, introducing likable characters and tactile interactions, which incentivise the child to progress all the way through the learning experience. This  study aimed to compare the efficacy of the MySpira application to traditional educational material (e.g. leaflets and videos) to improve asthma treatment compliance, technique and user engagement amongst 110 schoolchildren, aged 6 to 13. The findings indicate that MySpira surpasses the traditional educational materials, specifically in terms of enjoyment rating, the use of different inhalers’ techniques, particularly in the younger group (aged 6-9 years). Therefore, MySpira may enhance the level of available asthma care in an attempt to resolve one of the major problems facing asthma suffers and their carers, notably effective use of asthma inhalers.,",",					,,,					,,,				,"
"
			Usability Evaluation and User Acceptance of Mobile Applications for Saudi Autistic Children
					",",											Usability Evaluation, 											User Acceptance of Mobile Applications, 											mobile use, 											saudi arabia, 											teaching									,","2021-04-09,","The evolution of mobile technologies in learning, has been increased the requirements for developing appropriate usability model to fall into the same line with mobile learning applications. Usability of mobile learning applications is a topic that is into research, this paper focuses a tailored designed model called (M-UTUAT) mobile usability model that combines People at the Centre of Mobile Application Development (PACMAD) and the unified theory of acceptance and use of technology (UTAUT) to form a more robust model. As an addition to the usability research, an application (ICT) was developed for children with speech delays and children diagnosed with autism spectrum. The application is a mobile/tablet-based application that developed according to mobile usability measures to get the maximum learning skills and abilities to help autistic children. It has been designed according to the needs of the children specific to their category and skills. The autism spectrum is a broad spectrum with high and low disabilities. The application consists of both visual and audio aids to help children feel comfortable and associate objects more easily with their original meaning and connections. (PECS) is one of the most common techniques that have been clinically proven to be effective in such cases. This application helped an individual with autism spectrum as well as children with speech delays or disabilities to communicate and correlate faster and easily. The application can help so many families by constructing a more communicative path for people with disabilities. The application is innovative that it developed in the Arabic language to serve Arabic learners as most of the autistic applications available serve English learners. Results gathered after questionnaire highlight the usability issues with the (ICT) application. We developed an app to overcome usability issues.,",",					,,,					,,,				,"
"
			Monitoring the Consumption of Electrical Energy Based on the Internet of Things Applications
					",",											Monitoring device, 											Power Consumption, 											Internet of Things.									,","2021-04-09,","One of the instrumental functional overheads in many commercial edifices and industrial plants is the electricity bill. The design and development of a Smart Power monitoring device used to make monitoring on the electrical parameters represented as voltage, current, and power of Wasit university buildings. The system has a unit with smart sensing to detect and control the electrical devices employed for daily activities by following different tariff rates. It has the capability to decrease consumer costs improving grid stability. A developed model was broadly examined and experimental results comparing these results with devices of conventional measuring. The Arduino based wireless powering meter is a non-invasive existing meter for domiciliary power with a WI-FI Connection. A split-core is used to measure the current transformers. 802.11b connection is a means for transmitting data through the home’s wireless router to the base station and monitoring web portal based on wireless sensor network. A clear projection for domestic data use is one of the aims of this project. By these data, it can supply estimation to consuming power. Optimizing and reducing power usage are the objectives of providing such data.,",",					,,,					,,,				,"
"
			Higher Order Thinking Skills for Improved Learning Outcomes Among Indonesian Students: A Blended Web Mobile Learning (BWML) Model
					",",											model, 											blended web mobile learning, 											hasil belajar, 											higher order thinking skills									,","2021-04-09,",,",					,,,					The purpose of this research was to produce a model that can be used as a reference in implementing hybrid learning and Problem Based Learning (PBL) in learning with the MoLearn application. This research was included in Research and Development/R&D type by developing the right learning model for the MoLearn application. The Blended Web Mobile Leaning (BWML) model test was conducted related to its validity and practicality. The result of research showed (1) quality test with average content validity (3.72) statistically in (rα = 0.25) and reliability in (α = 81), average construct validity (3.74), with validity of each aspect statistically in (rα = 0.20) and reliability in (α = 0.75). It can be concluded that the BWML model is qualified (valid in content and constructs, and reliable) by experts. (2) The feasibility test (practically used by students) had an average of 3.23 with a statistical aspect validity in rα = 0.91 and reliability in α = 0.99 This can mean that students stated that the model has novelty and is easy to use. The implication of this research is that a quality BWML model can be used to improve HOTs-based learning outcomes. Further research can be focused on looking at the effectiveness of the BWML model for improving HOTs-based learning outcomes,,				,"
"
			Mobile Application and Web 2.0 as an E-Participation Mechanism: A Literature Analysis
					",",											E-Participation, 											mobile application, 											web 2.0, 											e-government, 											digital society									,","2021-03-30,",,",					,,,					Every democratic government always in their goals in achieving inclusiveness in every decision-making process which will prevail in their efforts achieving the full principle of democracy, transparent, accountable, and good governance. Hence, e-participation has profoundly become one set of tools in bridging digital divide between people and their governments (C2G), governments and other government organisations (G2G), government and people (G2C), government and employees (G2E), and government and corporation (G2B) through the utilization advancement of information and communication technology (ICT). In regards to this, the mobile application and Web 2.0 system are often flagged for its potential in improving public participation which intended to improve the current lagging public services and to establish relationships between government and citizens based on virtual information sharing and public debate. Insight of this, does mobile application and Web 2.0 able to deliberately enhance e-participation in everydimension?Every democratic government always in their goals in achieving inclusiveness in every decision-making process which will prevail in their efforts achieving the full principle of democracy, transparent, accountable, and good governance. Hence, e-participation has profoundly become one set of tools in bridging digital divide between people and their governments (C2G), governments and other government organisations (G2G), government and people (G2C), government and employees (G2E), and government and corporation (G2B) through the utilization advancement of information and communication technology (ICT). In regards to this, the mobile application and Web 2.0 system are often flagged for its potential in improving public participation which intended to improve the current lagging public services and to establish relationships between government and citizens based on virtual information sharing and public debate. Insight of this, does mobile application and Web 2.0 able to deliberately enhance e-participation in everydimension?,,				,"
"
			Text Pre-Processing For The Frequently Mentioned Criteria From Online Community Homebuyer Dataset
					",",											Residential, 											Criteria, 											Purchase, 											User-Generated Data, 											Text Analysis.									,","2021-03-30,","Due to the competitive Malaysian residential market with a large number of residential projects that offered almost similar features lead to difficulties of residential purchasing among homebuyers. These days, homebuyers are very selective, careful, and required more time in deciding due to the high numbers of abundant, and problem residential projects in Malaysia. As a result, a high number of unsold residential projects were reported. Therefore, understanding homebuyer criteria in a residential purchase is crucially important towards successful Malasia residential projects in the long term. This paper identifies and prioritizing homebuyers criteria in mainland Penang, Malaysia from user-generated data in online property forums. 6000 data was extracted through RapidMiner software. Once data were processes, statistic analysis is used to determined and prioritize the homebuyer's criteria. The classification of criteria is made by the real estate experts.  The result of the study provides fresh insight into homebuyers' criteria. The findings should offer developers, government, potential homebuyers, and real estate agents a better understanding of homebuyers criteria in Penang, Malaysia. ,",",					,,,					,,,				,"
"
			Assisting Children with Autism Spectrum Disorder with Educational Mobile Apps to Acquire Language and Communication Skills: A Review
					",",											Autism spectrum disorder, 											educational mobile apps, 											language and communication skills									,","2021-03-30,",,",					,,,					This systematic literature review was set out to review available literature on autism spectrum disorder and educational mobile apps with the aim of investigating available educational mobile app and how teachers can utilize these apps in assisting autistic children in acquiring language and communication skills. In order to achieve the aim of the study, the researchers employed a systematic method of investigation. Fifty papers in the areas of autism, educational apps and teaching method for autistic children were downloaded. Twenty-six were carefully selected because of their relevance to the study. The papers were analyzed and the result showed that there are available educational apps that are effective in helping autistic children in acquiring language and communication skills.,,				,"
