paper_name,keywords_name,publishing_date,abstract,abstract2
"
			IoT Enabled Wearable Device for COVID Safety and Emergencies
					",",											Internet of Things (IoT), 											IFTTT, 											COVID, 											Macrodroid									,","2021-02-12,",,",					,,,					The worldwide outbreak of COVID-19 has significantly changed the mindset of the people and over the period they started practicing healthy lifestyle to contain the spread of the virus. Despite this, increase in the number of cases and death rates across the globe are major cause of concern. In addition to maintaining the healthy lifestyle it is also essential to exploit the technological advancements in the field of Internet of Things (IoT) in designing a cost-effective wearable device which could possibly indicate the early stages of virus infection. In this work, a low cost IoT enabled wearable device is designed which generates alerts in case of any of the measured parameter goes out of the normal range besides sending notifications.,,				,"
"
			Using Design-Based Research to Develop Innovation in Open University in Thailand
					",",											Design Based Research, 											Distance learning, 											Smart technology									,","2021-02-26,","This paper discusses Design-Based Research (DBR) used to  develop an innovation in a distance university. The innovation focuses on    self-study through technology. It has results in 3 aspects which are 1) Instructors can assess knowledge and prepare the content from both internal and external learning sources in accordance with students’ needs, 2) Students can analyze their ability in order to plan successful online learning by themselves, and 3) Instructional designers can analyze, plan, design activities and select learning resources in accordance with the content and learning behavior. This paper describes the concept of DBR with the sample of ""STOU Smartlearn"" innovation design which is a smart evaluation system of Sukhothai Thammathirat Open University (STOU).  The innovation was designed based on DBR process. It has been used with students and could be modified to suit students’ needs. The results of the two experiments with undergraduate students in the academic year 2018 and 2019 found that the effect size increased from .27 to .32.,",",					,,,					,,,				,"
"
			Adoption of Mobile Learning: The Influence And Opportunities For Learning During The Covid-19 Pandemic
					",",											Adoption of mobile learning, 											covid pandemic 19, 											online learning, 											student inter-ests									,","2021-03-16,",,",					,,,					Research It is designed using quantitative and qualitative approaches. The sampling technique used in this study was purposive sampling. The samples in this study were lecturers and students. Data collection techniques using questionnaires and interviews. Interviews were conducted by interviewing lecturers at several different campuses. The results of the interview show that mobile learning is the learning that students are most interested in because it can be accessed through their cellphones. Quantitative data analysis used the product-moment correlation test. The research subjects consisted of 110 students. The significance level of 0.001 (p <0.05) indicates that there is a significant influence between the adoption of mobile learning on student interest in learning during the Covid pandemic 19.,,				,"
"
			The Use of Mobile Phones and their Apps in Tourism Marketing in the Kingdom of Saudi Arabia
					",",											Mobile phone, 											tourism, 											marketing, 											smartphone apps.									,","2021-03-30,","This study aims at identifying the importance of using smartphone apps in tourism marketing in Al-Kharj Governorate in the Kingdom of Saudi Arabia. The study used the descriptive and analytical approach in studying its hypotheses and achieving its objectives. It concluded that the majority of the study sample use smartphones and their tourism apps in the process of obtaining information and complete the purchasing process for the tourist trip.These apps are used to attract tourists as the best advertising method that attracts the targeted market. The study presented a set of recommendations, the most important of which is increasing cooperation between the authorities that supervise the tourism activity in the governorate when designing these apps and working to develop the technological infrastructure in line with the nature of development in the field of smartphones.,",",					,,,					,,,				,"
"
			Evaluation of Students Performance using Fuzzy Set Theory in Online Learning of Islamic Finance Course
					",",											Fuzzy Set Theory, 											Student Performance, 											Online Learning, 											Islamic Fi-nance									,","2021-04-09,","The objective of this study is to evaluate student performance using fuzzy set theory in Islamic Finance online course. This study focuses on selecting best individual among 30 students that registered for Islamic Bank Management course. The variables that involved in this study are online quiz marks, online assignment marks and online self-learning time.  The outcome of the fuzzy set analysis was compared with final examination data. The methodology of this study involving converting real data to fuzzy set, intersection calculation, decision analysis using maximizing approach. Result of fuzzy set shows the best individual score is 0.9. This student selected as best candidate for student performance in online learning with considering three variables namely online quizzes, online assignment and online self-learning hour. The comparison with final examination marks shows a good agreement with fuzzy set theory that concluded best individual from fuzzy set theory exhibits highest performance during final examination. The main finding of this study can help educators to predict the best performer in online learning class. In the same time, finding of this study can act as guideline to advise students in achieving their desired grade for online learning course.,",",					,,,					,,,				,"
"
			Predictive Analytic on Human Resource  Department Data Based on Uncertain Numeric  Features Classification
					",",											Predictive Analytic, 											Naïve Bayes, 											Business Intelligence, 											Human Resource									,","2021-04-23,",,",					,,,					Business Intelligence is very popular and useful for a better understanding of business progress these days, and there are many different methods or tools being used in Business Intelligence. It uses combination of artificial intelligence, data mining, math, and statistic to gain better understanding and insight on the business process performance. As employees have an important role in business process, the desire to have a tool for classifying and predicting their wages are desirable. In this research, we tried to analyzed dataset from Human Resource Department, and this dataset can be used to analyst the data in order to draw a conclusion about whether any employees would prematurely leave the company, and then, a preventive action based on those parameters can be proposed. This is a kind of predictive analytic system which bases on Naïve Bayes, and it can predict whether an employee would leave or stay according to his or her characteristics. But the Naïve Bayes itself does not enough. So we develop a way to solve the problem using uncertain Numeric features classification on it. The accuracy of the result is depended on the amount and effectiveness of the training sets.,,				,"
"
			Designing Website-Based Scholarship Management Application for Teaching of Analytical Hierarchy Process (AHP) in Decision Support Systems (DSS) Subjects
					",",											Scholarship, 											Website Based Application, 											Teaching Analytical Hierarchy Process, 											Decision Support System									,","2021-05-04,",,",					,,,					Teaching Analytical Hierarchy Process (AHP) in Decision Support Systems (DSS) subjects encourages students to know how a good decision is taken. AHP itself in the field of education and teaching has been widely used as an effective and efficient method in solving educational problems. The purpose of this paper is to designing website-based scholarship management application for teaching of Analytical Hierarchy Process (AHP) in Decision Support Systems (DSS) subjects. Scholarship management using AHP is choosing the right criteria is very important. This system uses 5 criteria, namely academic value, academic achievement, non-academic achievement, parents 'income, and parents' dependents, as a basis for producing decision-supporting information. The scholarship management system is embodied in a website-based computer application. Utilizing this application provides more assistance to donors, so that the results of this learning are not only proven in theory but also in practice in real conditions. In addition, the Website-Based Scholarship Management Application can be run on a mobile basis and can be accessed wherever and whenever they are.,,				,"
"
			Real Time System Monitoring and Analysis-Based Internet of Things (IoT) Technology in Measuring Outdoor Air Quality
					",",											Air Quality, 											IoT, 											Web, 											Measuring, 											Internet of Things									,","2021-05-25,",,",					,,,					The presence of large peatland in Riau, Indonesia, could cause air pollution due to peatland fires which causes the presence of thick smoke every year in Riau,  dis-rupting human activities. In order to monitor the air quality, in this paper,  the main advantage of the  Internet of Things (IoT) is the ability to transfer data over the network without requiring human-to-human or human interaction to the com-puter   used. In this paper, we propose an air quality monitor that can display web-based information to show the temperature and air humidity, and detects CO, CO2 gases, and alcohol in real time with the help of DHT11 and MQ135 sensors, Arduino Uno and Raspberry Pie. The results show our proposed system can successfully show each parameter of the air quality on the website and make suggestions about the overall air quality level. With our proposed system, we hope the government can respond faster to mitigate the bad air quality level and give information to public about the air quality level in a faster and more accurate way.,,				,"
"
			Helping Junior High School Student to Learn Fibonacci Sequence with Video-Based Learning
					",",											Fibonacci, 											Junior High School student, 											Video Based Learning, 											Geometry Sequence									,","2021-06-04,",,",					,,,					In the 21st century, a teacher must be able to make teaching and learning activities conductive, fun That can improve students’ learning interest. Fibonacci sequence material is one of the materials that is difficult for Junior High school students to master. Based on this problem, the focus of this research is to create video learning on Fibonacci sequence material using Hawgent. This research is developed in Guangxi Normal University, China. This research is a research and development (RnD) using 4D model. 4D model consists of Defining, Design, Development, Dissemination. Video learning is made using interesting animations that are easy for students to understand. The results of this study indicate that the video learning has passed validation and can be sent to schools to help students understand Fibonacci sequence,,				,"
"
			Professional Skills Development Through the Network Learning Community Using an Online Learning Platform
					",",											Networked Learning Community, 											21st century learning, 											multimedia industry, 											live streaming media									,","2021-06-18,",,",					,,,					Networked learning Community (NLC)  that integrates a professional context into the learning experience that uses learning networks to promote self-efficacy and professional development. Online Learning design integrates three techniques: focus on developing personal learning networks, live streaming and online based learning communities and immersive skills and experience mastery for professionals. The hypothesis is that networked learning community among peers in the online learning will help support skills development and confidence in sustainable use of the platform in a personalized way. Meanwhile networking for learning with professionals will strengthen the impact of mastery experience on self-efficacy. Learning experiences as relevant for lifelong learning and professional success are important in today's learning era. NLC aligned with the goals of the 21st century skills movement can be an important mechanism for scaling up efforts to redesign academies that offer skills with a forum for broad but personal learning. The live streaming technique in the learning process in online media has a significant impact in monitoring and monitoring one-on-one learners' abilities. Learning outcomes can be easily corrected and evaluated by relevant experts so that the work can be used as a good portfolio. In the application of the  NLC the target output is that there is a promotion mechanism for students to the industrial world by bringing together professional companies and / or developing entrepreneurship with the addition of business training to the relevant NLC. The results of the platform development show that the flow and process of improving skills and professional learning with the community in one field of multimedia industry is getting better,,				,"
"
			The Impact of Teaching by Using STEM Approach in The Development of Creative Thinking and Mathematical Achievement Among the Students of The Fourth Scientific Class
					",",											STEM Introduction, 											Innovative Thinking, 											Mathematical Achievement									,","2021-07-13,","The research aims to know the impact of science, technology, engineering, and mathematics education on both creative thinking and mathematical achievement. To achieve it, the two researchers followed the quasi-experimental approach with an experimental design for two groups, one experimental and the other a control. The research sample consisted of (32) female students from the fourth scientific grade in Al-Intisar Preparatory School for Girls / Al-Rasafa, First Directorate. The sample was chosen intentionally and was divided into two groups: a control group studying by the traditional method, their number (16), and an experimental group that applied the STEM approach, their number also (16). There was parity between the two research groups in the variables (chronological age, previous achievement in mathematics, innovative thinking). The research tools consist of testing innovative thinking skills (fluency, flexibility, originality, relationships) and achievement tests. The research experiment was applied before and after. To test the validity of the hypotheses, data were collected and then statistically analyzed using appropriate statistical methods. The results of the research found that there were statistically significant differences in both the tests of innovative thinking and mathematical achievement in favor of the experimental group that studied according to the STEM approach, and in light of the results, the researchers recommended several recommendations and suggestions.,",",					,,,					,,,				,"
"
			The Influence of Sports Activities on College Students' Social Adaptability
					",,"2021-07-28,","The cultivation of talents has always been the basis of the development of economy, science and technology and the overall strength of all countries. With the further deepening of China's reform and opening up, the rapid development of the market economy and the gradual improvement of the level of information technology, the education sector is paying more attention to the cultivation of talents in all walks of life in China. As for college students is about to walk into society, how to learned during college all kinds of professional knowledge and skills in the future life and work, how reasonable in the future workplace, properly handle interpersonal relationships, how to better integrate into social life, reflect their own value, and to raise their competitive strength, and observe the rules and regulations, laws and regulations, Have a good moral integrity, set up the correct world outlook, outlook on life, values. All these are closely related to the social adaptability of college students. Physical education is an important way to implement quality-oriented education and cultivate talents with all-round development, which was clearly pointed out in the Guidelines for Physical Education Course Teaching in National Colleges and Universities issued in 2002.In the given physical education teaching objectives also explains that the students are required to show good sports ethics and cooperative spirit as well as correctly deal with the relationship between competition and cooperation.,",",					,,,					,,,				,"
"
			Image Denoising Using Multiwavelet Transform with Different Filters and Rules
					",",											Denoising, 											Multiwavelet, 											Thresholding, 											Soft Thresholding									,","2021-08-11,","Image denoising is a technique for removing unwanted signals called the noise, which coupling with the original signal when transmitting them; to remove the noise from the original signal, many denoising methods are used. In this paper, the Multiwavelet Transform (MWT) is used to denoise the corrupted image by Choosing the HH coefficient for processing based on two different filters Tri-State Median filter and Switching Median filter. With each filter, various rules are used, such as Normal Shrink, Sure Shrink, Visu Shrink, and Bivariate Shrink. The proposed algorithm is applied Salt& pepper noise with different levels for grayscale test images. The quality of the denoised image is evaluated by using Peak Signal to Noise Ratio (PSNR). Depend on the value of PSNR that explained in the result section; we conclude that the (Tri-State Median filter) is better than (Switching Median filter) in denoising image quality, according to the results of applying rules the result of the Shrinking rule for each filter shows that the best result using first the Bivariate Shrink.,",",					,,,					,,,				,"
"
			Systematic Review of Enhancement of Artificial Bee Colony Algorithm Using Ant Colony Pheromone
					",",											Artificial bee colony, 											Pheromone, 											Ant Colony									,","2021-08-23,",,",					,,,					The artificial bee colony (ABC) is a well-studied algorithm developed to solve continuous function optimization problems by Karboga and Akay in 2009. ABC has been proven to be more effective than other biological-inspired algorithms with good exploration. However, ABC suffers from low exploitation and slow convergence in some cases. The ABC algorithm study has risen significantly over the past decade, with many researchers trying to improve ABC performance and apply it to solve problems. One method to enhance ABC is to borrow exploration technique from other algorithms. Researchers use pheromone, which is a technique used by Ant Colony optimization algorithm, to enhance ABC and addressed several aspects of using a pheromone to enhance the ABC. This systematic review aims to review and analysis articles about using pheromone to enhance ABC. Articles on related topics were systematically searched in four major databases namely Scopus, Web of Science, Association for Computing Machinery ACM and Google Scholar. To ensure that all research articles were considered the start date is not restrictions the search carry out till February 2021.Five articles were selected based on our inclusion and exclusion criteria for the systematic review. The results show that the use Pheromone to enhance ABC can increase the ABC exploitation ability and overcoming the late convergence. This paper also illustrates several potential pheromone using for future work.,,				,"
"
			The Acceptance of Mobile Learning: A Case Study of 3D Simulation Android App for Learning Physics
					",",											m-learning, 											3D-simulation, 											Android									,","2021-09-06,",,",					,,,					This study investigates the adoption of the mobile learning, 3D simulation Android app, as an innovative tool for learning in physics for high school students. The factors affecting the acceptance of mobile learning are also determined in this study. The proposed research model employs two constructs, Perceived Usefulness and Perceived Ease of Use, from Technology Acceptance Model (TAM) as a baseline and adds another relevant factor based on prior mobile learning adoption research, Perceived Enjoyment. Data are collected through questionnaires distributed to 50 high school students using Google Forms. Structural equation modeling (SEM) is used to analyze and develop the research model. The study finds that Perceived Enjoyment becomes the most influencing factor considered by high school students to use mobile learning, 3D simulation Android app, followed by Perceived Usefulness. However, the Perceived Ease of Use factor does not significantly influence the acceptance of the 3D simulation Android app.,,				,"
"
			The Relationship Pattern of Internet Usage Frequency, Generation Z Characteristics, and Teaching Method in the Millennium Era
					",",											correspondence analysis, 											generation z, 											internet, 											teaching method									,","2021-09-20,",,",					,,,					Generation Z students mount challenges to develop teaching methods in the millennium era due to their diverse characteristics from the previous generation as they are proficient in utilizing the internet, less attentive to each other and the environment, prefer immediate things regardless of all complex processes they shall go through. This study aims to seek the relationship pattern between Generation Z clusters, teaching methods, and internet usage frequency. This study involved 222 junior high school students in Jakarta. The two-step cluster, cross-tabulation, and correspondence analysis were used for data analysis. The method used is correspondence analysis. The findings indicated that internet usage frequency has a significant relationship with Generation Z clusters and teaching methods. The results concluded that students who use the internet less than five hours prefer the full tutorial method and group assignments, and those who use the internet more than five hours prefer tutorial and field assignments,,				,"
"
			i-TCE 2008 - International Conference on Technology, Communication and Education
					",,"2007-10-12,",,
"
			ICELW - The International Conference on E-Learning in the Workplace
					",,"2007-10-12,",,
"
			IMCL2008 - 3rd International Conference on Interactive Mobile and Computer Aided Learning
					",,"2007-10-12,",,
"
			A Remote WIRELESS Facility
					",,"2007-10-11,",,",					,,,					Continuing need for available distance learning facilities has led to the development of a remote lab facility focusing on wireless technology. In the field of engineering there is a student need of gaining experience in set-up, monitoring and maintenance of  802.11A/B/G based wireless LAN environments.,,				,"
"
			From the Editor
					",,"2007-10-12,",,
"
			Factors that may contribute to the establishment of mobile learning in institutions â?? Results from a Survey
					",",											distance education, 											education innovation, 											mobile learning, 											mLearning, 											mobile devices.									,","2007-10-11,",,",					,,,					This paper reports on a survey investigating the role that differences in expectations and perceptions of mobile learning and mobile devices play in establishing mobile learning at an educational institution.   Responses from institutions with no institutional plans for mobile learning and others that do plan or currently have developed mobile learning programmes were compared.  Various factors that may contribute to the establishment of mobile learning in educational institutions were therefore also investigated.  These factors include, amongst other, expectations concerning the impact of mobile technologies on teaching and learning, and perceptions concerning mobile learning applications and mobile learning activities.,,				,"
"
			Potentials and Challenges of Mobile Media in Museums
					",",											Adaptive systems, 											informal learning, 											information retrieval, 											mobile communication, 											museums, 											unsupervised learning									,","2007-10-11,",,",					,,,					In this article we discuss potential scenarios of use for mobile media in museums and the challenges they pose. We examine how the characteristics of mobile technology suit the specific characteristics of a museum setting. Based on these considerations different ways to support visitors with mobile devices are put forward: attentional focus and guidance; satisfaction of situational interest; information adaptation to a specific visitor and to a specific location; information elaboration through facilitation of knowledge exchange and documentation of the visit, as well as assistance in exhibition evaluation. Implications for the development of mobile applications in museums are derived.,,				,"
