,article_title,abstract
1164,MODEL-Based Performance Quality Assessment for IoT Applications,"The number of applications incorporating Internet of Things (IoT) concepts increases extraordinarily. This increase cannot continue without high-quality assurance. There are some difficulties in testing IoT applications; the system heterogeneity, test cost and time are taken to test the system, and the precision percentage of test results.A well-known and possibly the best solution to overcoming these difficulties is to model the system for evaluation purposes, known as model-based testing (MBT). This paper aims to design a model-based testing approach to assess IoT applications performance quality attributes. The ISO 25000 quality model is used as a standard for software quality assurance applications. IoTMaaS is used as a case study to implement the methodological approach. The possible test cases were generated using the ACTS combinatorial test generation tool. The performance metrics of each test case were monitored until the optimum test case was identified, with the shortest response time and the least amount of resources used. The proposed testing method appears to be successful, according to the results.,"
1165,Blended Learning Model with IoT-based by Smartphone,"In 2021, the COVID-19 pandemic is still not over. Thailand is the one that is facing the second wave of new coronavirus. Schools and universities were closed, and faculties need to mostly teach with Online pedagogy, including the graduate students' courses. This study proposes to focus on the Ubiquitous area of the Blended Learning model with IoT-based to solve a problem of graduate students and their advisors by the qualitative focus-group technique. The mobile application draft was synthesized and designed to track and monitor graduate students' research activities on smartphones by built-in sensors. They should stay active along while researching the advisors assignments on their smartphone. Non-active periods are implied when several behaviors are detected. Virtualize dashboards are processed to report the total active learning period of students for the advisor's evaluation.Moreover, students can continually monitor their self-efficacy to improve the online learning process. Besides, this study proposes to confirm the models quality by twelve experts with the questionnaire. The results show average scores of Propriety, Utility, Feasibility, and Accuracy standard are 4.32, 4.41, 4.37, and 4.21, respectively. Therefore, the Blended Learning model's overall qualities with IoT-based smartphones are extremely high and proper to implement.,"
1172,Flashover Prevention System using IoT and Machine Learning for Transmission and Distribution Lines,"Flashover on transmission and distribution line insulators occurs when the insulators resistance drops to a critical level and causes frequent power outages. Thin layers of dust, salt, and airborne particles, gradually deposited on the surface of insulators, as well as humidity, form an electrolyte which causes flashover.  In this paper, a flashover prevention system using IoT technology and machine learning is proposed in order to reduce loss and increase power reliability. The system includes an IoT module, a service and clients. The IoT module prototype was installed at a distribution line pole located in Pracha-utit, Bangkok, Thailand and had collected data for thirty-four months. The data were pre-processed and split for the training process and evaluation. In this study, we built and compared four models including linear regression, polynomial regression, Auto-regressive Integrated Moving Average (ARIMA) and Long Short-Term Memory (LSTM) models. The results revealed that the LSTM model outperformed (=.931, RMSE= 530.74) the others."
1178,Face Recognition Using the Convolutional Neural Network for Barrier Gate System,"The implementation of face recognition technique using CCTV is able to prevent unauthorized person enter the gate. Face recognition can be used for authentication, which can be implemented for preventing of criminal incidents. This re-search proposed a face recognition system using convolutional neural network to open and close the real-time barrier gate. The process consists of a convolutional layer, pooling layer, max pooling, flattening, and fully connected layer for detecting a face. The information was sent to the microcontroller using Internet of Thing (IoT) for controlling the barrier gate. The face recognition results are used to open or close the gate in the real time. The experimental results obtained average error rate of 0.320 and the accuracy of success rate is about 93.3%. The average response time required by microcontroller is about 0.562ms. The simulation result show that the face recognition technique using CNN is highly recommended to be implemented in barrier gate system."
370,Multi-viewpoint Smartphone AR-based Learning System for Solar Movement Observations,"Understanding solar movement (e.g., solar diurnal motion) is difficult for those are beginning to learn about astronomy. Previous research has revealed that observation-based learning can help make astronomical phenomena clearer to understand for such learners. In this research, Smartphone Augmented Reality (AR) technology and 3D content were used to develop a multi-viewpoint Smartphone AR-based learning system (M-VSARLS) for solar movement observations that can be used in the real-world environment. The goal of this research is to assess the usefulness of the system, usability of the AR function and 3D content, and the overall effect of the system on the learners motivation through task-based experiments with follow-up questionnaires. The results show that the M-VSARL system is effective in improving the observational skills and learning ability of learners, and in enhancing their motivation to learn about solar movement."
380,Lunar Observation Support System Using Smartphone AR for Astronomy Education,"It is possible to improve learnersâ?? understanding of the concept of lunar phases by using Observation based Learning (OBL). In this research, Smartphone Augmented Reality (AR) technology was used to develop a multi-viewpoint AR-based mobile learning (M-VARML) system for moon observation that can be used in the real world environment. An experiment was conducted to evaluate the usefulness of our system. Participants were given five moon observation tasks, which they had to perform manually and using the M-VARML system. After each task, they were given follow-up questionnaires on the usefulness of the functions in the system. Finally, they were asked about the operational usability and the effect our system had in motivating them to pursue lunar observation. The results show that the M-VARML system is effective in improving the observation and learning of students and in enhancing their motivation to pursue lunar learning."
428,Sensory Media: Multidisciplinary Approaches in Designing a Situated & Mobile Learning Environment for Past Topics,"Handheld digital devices are rapidly increasing their sensory capabilities for registering multiple types of input, such as movement, orientation, position and touch, as well as light and sound. Mobile Augmented Rreality is one of the emerging forms of representation and expression that exploits these sensory media. In the following text we will present and discuss a type of indirect augmented reality, which we call situated simulations. In a situated simulation there is approximate identity between the 3D environment displayed on the screen and the user's real perspective on a given location. This makes it possible to create simulations of relevant objects and environments related to a specific place, for example, interpretations of its past. We present a situated simulation"
500,A Systematic Review of Learning Through Mobile Augmented Reality,"In the beginning of 2000, researchers started to see the potential of using Augmented Reality (AR) in educational and foresaw that further research within the field. Since then, AR research have taken many different approaches. This is also true for AR in relation to pedagogical purposes. This study is to investigate what has been studied within the AR field related to mobile augmented reality. It attempts to make systematic review of how learning and pedagogical aspects have been approached in the articles. In recent years, mobile augmented reality has become increasingly interesting due to the mobile devices small form factors and their ability to let the students move around freely while learning. The aim of this study is to make a systematic review of pedagogical uses of mobile augmented reality. Based on a review of previous literature of mobile AR systems for pedagogical purposes, published between 2000-2017, make it possible to see in which direction mobile AR systems for education are heading and how future mobile AR systems should be designed to best fit the needs of future students so they can more effectively improve their learning.,"
516,Augmented Reality: Daily Prayers for Preschooler Student,"Education is one of the aspects that many synthesized with technology. Yet, this is contrary to the fact that where most of the learning materials are still based on text. This research aims to develop an alternative learning media by implementing Augmented Reality Technology for Preschooler students. Augmented Reality (AR) is an application that can combine the virtual object as text, pictures and animation into the real world. Development of Augmented Reality application uses Web Aurasma Based Studio, with learning materials of daily prayer for preschool student. The development of the characters and the animations were using Adobe Illustrator and Adobe After Effects. The results of the study showed that technology Augmented Reality can be used as an alternative learning media especially in the learning process in Preschool Al Furqon. This is because the content Augmented Reality in the form of animation can gives more understanding and attention for preschool student to follow the learning process"
522,Markerless Augmented Reality Utilizing Gyroscope to Demonstrate the Position of Dewata Nawa Sanga," in Hinduism has an important role as the foundation of the religious concept implemented by Hindus in Bali, Indonesia. It has the meaning of nine deities or manifestations of Ida Sang Hyang Widhi Wasa (God Almighty)  that guard or control the nine wind direction.  in terms of education in Bali has been learned by the elementary school students. However, in social life the concept of  itself has not been attached and understood by all Balinese Hinduism yet. Based on the problem in social life, there is an idea to develop Markerless Augmented Reality Utilizing Gyroscope to Demonstrate the Position of . This application is designed to know, recognize, and understand the characteristics of  using gyroscope. This sensor serves to fulfill the object of the deities in the coordinates to be determined. Furthermore, it serves to provide information about  along with the innovative and informative 3D animation. The result of usefulness questionnaire of this application percentage value average is 88.4%. It can be concluded that AR  is very useful and helpful for learners in exploring the  position in a real-world environment. The result of usability and satisfaction questionnaire of this application percentage value average is 84.8%. It shows that the application is very useful for the participants to learn  and very satisfied to use.,"
526,Development of the MARPEX App Embedding the Mobile Augmented Reality Factors for Learning Motivation in Science Experiments,"Mobile Augmented Reality (MAR) has grown exponentially over the last four decades from imagination to real physical experience, especially in education. Previously, experts have completed the concepts of effectiveness, usability, acceptance and understanding in designing MAR applications to introduce and expose technological advances. However, most of these applications are addressed extensively for classroom science learning, while science experiments receive little attention. Students have to go through difficulties in understanding the phenomena of science and consequently become dissatisfied with their grasp on basic knowledge and eventually cannot pursue higher education or career related to science. This paper presents the development of Mobile Augmented Reality for Physics (MARPEX) application for high school students. The purpose of this application is to enhance the learning motivation in science experiments through the content of modern science. It aims to provide an individual learning experience for each student in science experiments. The MARPEX app design has gone through several phases of filtering and evaluation based on the specified objectives. This application needs to maintain the factors necessary to achieve this goal. This app has been designed and developed specifically for science (physics) experiments on the topic of electromagnetism. The application encrypts several experimental instances with the addition of good visualization to understand this phenomenon and has real-life experimental experience"
531,A Conceptual Model of Mobile Augmented Reality for Hearing Impaired Museum Visitors Engagement,"Many studies have begun to consider how to ensure a pleasant experience during visits to cultural heritage sites and museums. Although, when considering the populace of the visitors to these sites, the hearing impaired (HI) visitors which made up of a smaller percentage, have not been in the literature limelight as much as the normal hearing visitors. Thus, the hearing impaired tends to endure certain unpalatable experiences leading to dissatisfaction of their visits. Literature has shown that Mobile Augmented Reality (MAR) can improve the experiences of visitors to the museum in terms of engagement, enjoyment and learning. This is evident in a number of articles tailored towards normal hearing visitors. However, a recent study has taken into consideration the hearing impaired visitors by identifying the engagement elements of MAR for the HI museum visitors. The identified elements include; aesthetics, interaction, interest, usability, satisfaction, motivation, curiosity, enjoyment, perceived control, self-efficacy, and focused attention. This article thus takes a step further by introducing the MAR for the HI museum visitors engagement (MARHIME) conceptual model. These elements are derived from a review of literature which has been done comprehensively and are validated by a panel of experts. Altogether eleven elements went through the expert review process and only six elements were validated to be used for the construction of the MARHIME model. This article also further grounds the justification of these selected six elements in relation to engagement. Future work will include the development of the MARHIME prototype which will be used to validate the model among the hearing impaired visitors at a museum."
1220,Monitoring the Consumption of Electrical Energy Based on the Internet of Things Applications,"One of the instrumental functional overheads in many commercial edifices and industrial plants is the electricity bill. The design and development of a Smart Power monitoring device used to make monitoring on the electrical parameters represented as voltage, current, and power of Wasit university buildings. The system has a unit with smart sensing to detect and control the electrical devices employed for daily activities by following different tariff rates. It has the capability to decrease consumer costs improving grid stability. A developed model was broadly examined and experimental results comparing these results with devices of conventional measuring. The Arduino based wireless powering meter is a non-invasive existing meter for domiciliary power with a WI-FI Connection. A split-core is used to measure the current transformers. 802.11b connection is a means for transmitting data through the homes wireless router to the base station and monitoring web portal based on wireless sensor network. A clear projection for domestic data use is one of the aims of this project. By these data, it can supply estimation to consuming power. Optimizing and reducing power usage are the objectives of providing such data.,"
1268,Encryption System for Hiding Information Based on Internet of Things,"One of the unexpected intelligence tactics known in World War II was to conceal the data in images that were reduced to the size of a point that was used in every text and transported in front of the enemy's eyes. In the new age, and after the expansion of Internet science and the use of the Internet worldwide, we will establish a security feature of the IOT service that will work more reliably and more effectively to deal with the Internet of Things and ensure the work of the services that the customer interacts with. A secret-key stenographic scheme that embeds four gray-scale secret size (128*128) pixel images into a size (512*512) pixel cover image in this work. Wavelet transform is the method used in this project to analyze the cover into its frequency components. In this work, combinations of steganography and cryptography were made to increase the level of safety and make the device more difficult for attackers to beat. The resulting stego-image that will be transmitted did not raise any suspicion by both objective and subjective evaluation, so the primary objective of Steganography is achieved. The proposed system was designed by using (MATLAB R2018b) and running on a Pentium-4 computer. The Internet of Things works with the encryption system for data in a synchronized manner with the technological development, and in order to maintain the stability of any Internet of things service, whether it is information signal services, visual or audio data, a remote control system, or data storage in the Internet cloud, we must focus on data preservation from internet pirates and internet system hackers. The picture Figure4 below shows the method of encryption and dealing with the Internet of things system..,"
753,Design and Use of a Mobile Application to Prevent Teachers Absenteeism in a Higher Education Setting,"In this paper, we present a digital application developed to prevent teachers absenteeism in a private university in Indonesia. In particular, we evaluated the development and the application of an Android-based attendance management system (AAMS) to monitor teachers attendance and their teaching activity at a private university in the capital city of Jakarta, Indonesia. Adopting a design-based research approach, we observed the development procedure and interviewed three end-users of the application, i.e. teachers. The findings of the study revealed the potential use of AAMS as a digital tool to prevent absenteeism among university teachers. The three main challenges were highlighted during the application of AAMS, including the processing time duration and system error, the reporting and analytics issues, and the input manipulation. Furthermore, a recommendation is offered on the basis of the findings."
758,"Development of Jawi Spelling Skills Mobile Applications, 'Oh Jawiku'"," In the past, Jawi script was the main medium of intermediation in Malaya. However, since the emergence of the Roman script, the use of Jawi script has been marginalized causing less awareness among some of the younger generation on the uniqueness of Jawi script. Therefore, a mobile application has been developed to attract students to explore Jawi script especially the spelling of Jawi words. This Jawi Spelling Skills mobile application used constructivism approach and ADDIE model during the development process. This study used quantitative one group pre-test and post-test research design that conducted among 20 students of a primary school. The result shows that the mean value of the post-test was higher than the pre-test which is 89.00 while the percentage of students who liked the Jawi Spelling Skills mobile learning application was high. In conclusion, the application of Jawi Spelling Skills Mobile Learning Application able to attract students to learn Jawi indirectly raised the dignity of Jawi script in the future besides supporting the 21st- century education.,"
840,The Role of Game Elements in Improving Jawi Skills through a Mobile Game 'G-Jawi',"The existence of a game-based mobile application in the field of education has largely helped students to be more interested and motivated to learn due to the presence of game elements in the apps which makes learning more interesting. The  script is one of the subjects that is difficult to learn by younger generation since they do not apply the use of  in their private lives. The inclusion of creative features such as game elements should attract students to explore the  script. A pre- experimental one- group pre- test and post- test study was conducted in which a game-based mobile application for learning  subject named G- was developed and tested among 20 primary school students in order to observe how the elements of the game in the mobile app impacted their  spelling skills. The apps were also evaluated by 5 teachers and the findings shows that the game-based mobile application was able to improve the students performance. This finding was supported by positive results amongst the students which revealed a mean value for the post- test was higher than the pre- test of 89.00. In conclusion, the mobile games app has successfully enhanced students understanding of  subjects compared to the traditional learning methods."
905,A Proposed Framework of Campus-Oriented Online Text Messaging System,"Nowadays, the rapid advancement of mobile software development has triggered to emerge of more online text messaging applications. In the environment of higher education institutions, it is also widely utilized to support the communication process between campus members. This research proposed a system of campus-specific online text messaging that is expected to improve academic activities. As a case study, the system was implemented using  framework and  for use in State Polytechnic of Malang, Indonesia. The system consists of three main subsystems that work together, including   and . To evaluate the proposed system, we conducted a survey. The result of the user satisfaction test shows that most users consisting of lecturers, staff, and students felt more helped in the communication process in the campus environment."
906,Developing an Android-Based Mobile Application for Civic Education Learning,"The study has developed an android-based mobile application that can assist in the teaching-learning process of civic education in senior high schools. As a research-and-development activity, it employed the ADDIE model (Analysis, Design, Development, Implementation, and Evaluation). Based on validation by material experts, the developed application was very feasible to use (89.04%), and the media experts concurred with this assessment (90.78%). During the large-group trials, the application scored between 3.96 and 4.68, meaning that it provides an excellent media or platform with high feasibility for the teaching-learning process of civic education in senior high schools."
940,Interactive Mobile Applications to Support the Teaching of Reading and Writing of Spanish for Children in Primary Education,"In the educational process, literacy is considered as a fundamental part, which focuses on the ability to read and write. Reading and writing are processes that, although they have features in common, they may not be developed in parallel, but both are encompassed in teaching methods that aim to develop these two skills at the same time. Interactive mobile applications can be part of a strategy to support the teaching of reading and writing skills. This paper presents a review of five interactive mobile applications to support the teaching of Spanish reading and writing skills. Mobile applications were analyzed based on their general features and the activities they have. The following general features were taken into consideration: the existence of voice assistants, supporting characters, language selection, progression of activities, creation of avatars, variable difficulty, progress panel, images, among others. The activities considered for the revision were those that allow completing syllables, completing words from letters, completing words from syllables, completing sentences, relating images to words, among others."
