,article_title,abstract
618,The Development of Mobile Learning Application using Jigsaw Technique,"Teacher ability to arrange learning environmet will affect the students interest in learning as well in utilizing mobile technology. The purpose of this research is to develop mobile learning using the cooperative learning approach especially Jigsaw technique. The method of this research is development research using ADDIE (Analysis, Design, Development, Implementation, and Evaluation) model. The application was validated by experts for technical aspects and also students from two different grades, i.e grade VII and grade VIII on physics subject for application acceptance responses. The result showed that both technically and application acceptance were in good level. It means that this mobile cooperative learning application can used to enhance students learning interest."
629,Support of Mobile Phones in a Private Network for Science Teaching,"The potential of mobile phones to facilitate students science learning, when they are engaging in group activities, was investigated. To minimize the disciplinary issues emerged from the previous research on mobile devices and to enhance the quality of learning, a set of mobile phones that are connected to a private network was used. The lesson planning and implementation through these mobile phones were facilitated by a web based Application. A purposively selected group of teachers developed three lessons while integrating mobile phones in a private network into learning activities. Then the lessons were implemented in real classroom settings. This paper is based on one of the lessons ‘Waves and their Characteristics that was implemented for Grade 11 students. The data were collected through observations using audio, video and field notes and were analyzed using thematic analysis technique with the help of NVivo10 qualitative data analysis software. Based on the thematic analysis, two assertions were derived. Notably teachers appreciated the support of the private network in enhancing the quality of group learning activity while minimizing the students misuse of mobile phones."
649,"Mobile Learning Design Models for State University of Jakarta, Indonesia","In facing the industrial era 4.0, the instructional paradigm requires the involvement of technology in it. The use of technology in instructional is sometimes regarded as a medium or tool for delivering information through technology from lecturers to students without considering the learning process of students with technology that makes learning outcomes more meaningful. Meanwhile, instructional media such as mobile learning applications through Android is a type of mobile learning that can change the way students communicate and interact. The use of mobile learning applications through Android is adjusted to the characteristics of students and learning needs in the industrial era 4.0. This study resulted in an Android-based mobile learning application so that through product effectiveness, the concept of the conceptual model of mobile learning was obtained in the industrial era 4.0 for learning in college. The research method used is the development research of William W. Lee and Diana L. Owens. The results showed that the mobile learning application influenced student academic achievement so that the conceptual model of mobile learning was obtained in the industrial era 4.0 for learning in college. This study concludes that mobile learning applications encourage students in fun learning activities and place students as the main subject in learning, so learning becomes meaningful.,"
683,Towards a New Scalable Big Data System Semantic Web Applied on Mobile Learning,"In Web 3.0, semantic data gives machines the ability to understand and process data. Resource Description Framework (RDF) is the liagna franca of Semantic Web. While Big Data handles the problematic of storing and processing massive data, it still does not provide a support for RDF data. In this paper, we present a new Big Data semantic web comprised of a classical Big Data system with a semantic layer. As a proof of concept of our approach, we use Mobile-learning as a case study. The architecture we propose is composed of two main parts: a knowledge server and an adaptation model. The knowledge server allows trainers and business experts to represent their expertise using business rules and ontology to ensure heterogeneous knowledge. Then, in a mobility environment, the knowledge server makes it possible to take into account the constraints of the environment and the user constraints thanks to the RDF exchange format. The adaptation model based on RDF graphs corresponds to combinatorial optimization algorithms, whose objective is to propose to the learner a relevant combination of Learning Object based on its contextual constraints. Our solution guarantees scalability, and high data availability through the use of the principle of replication. The results obtained in the system evaluation experiments, on a large number of servers show the efficiency, scalability, and robustness of our system if the amount of data processed is very large."
690,The Effectiveness of Mobile Learning Based Android in Learning English Vocabularies,"This study aims to determine the effectiveness of mobile learning based android in learning vocabulary at the seventh-grade students of SMP Batara Gowa. This type of research is pre-experimental. The research design used was pre-experimental design, namely one group pre-test post-test design. The populations in this study were all seventh-grade students of SMP Batara Gowa, and the sample was class VII.1 as the experimental class which was chosen by using purposive sampling. The results of the data analysis show that the mean score of post-test (70.55) was higher than the mean score of pre-test (34.65). The result of the t-test was 30.117 and t-table 2.093. It could be indicated that the null hypothesis (H0) was rejected and the alternative hypothesis (H1) was accepted. Based on the effectiveness criteria, generally using mobile learning based android was effective in learning vocabulary at the seventh-grade students of SMP Batara Gowa.,"
708,Understanding the Quality Determinants that Influence the Intention to Use the Mobile Learning Platforms: A Practical Study,"There is a widespread use of Internet technology in the present times, because of which universities are making investments in Mobile learning to augment their position in the face of extensive competition and also to enhance their students learning experience and efficiency. Nonetheless, Mobile Learning Platform are only going to be successful when students show acceptance and adoption of this technology. Our literature review indicates that very few studies have been carried out to show how university students accept and employ Mobile Learning Platform. In addition, it is asserted that behavioral models of technology acceptance are not equally applied in different cultures. The purpose of this study is to develop an extension of Technology Acceptance Model (TAM) by including four more constructs: namely, content quality, service quality, information quality and quality of the system. This is proposed to make it more relevant for the developing countries, like the United Arab Emirates (UAE). An online survey was carried out to obtain the data. A total of 221 students from the UAE took part in this survey. Structural equation modeling was used to determine and test the measurement and structural model. Data analysis was carried out, which showed that ten out of a total of 12 hypotheses are supported. This shows that there is support for the applicability of the extended TAM in the UAE. These outcomes suggest that Mobile Learning Platform should be considered by the policymakers and education developers as being not only a technological solution but also as being new e-learning platform especially for distance learning students.,"
715,Using Mobile Learning Tools in Higher Education: A UAE Case,"Research indicates that mobile learning (ML), has the potential to transform teaching and learning. Despite its benefits, mobile learning adoption is a challenging process which requires support to facilitate its integration. The focus of this article is to investigate the factors that could affect ML acceptance. The quantitative and qualitative data collected from the surveys revealed additional information regarding the pedagogical benefits of and obstacles to mobile learning integration. Even though participants in this study reported to be late adopters of technology, they  maintained that ML is useful for learning, specifically ubiquitous learning. Teachers also noted that mobile learning integration is more successful when aligned with local cultural norms.  Mobile learning tools that might be culturally appropriate in one context may not always be accepted in another.  Findings of this study provide several implications and recommendations for future research on mobile learning implementation. Further research could explore the development and utilization of a rubric with specific criteria for evaluating mobile learning applictations."
727,A Study of Students Motivation in Using the Mobile Arc Welding Learning App,"Welding is an introductory core subject that is taught in every mechanical engineering programs at all polytechnics in Malaysia. Normally students will learn the theoretical concepts of welding in the class followed by instruction based training in the workshop.   However, students have difficulty to follow everything that has been taught in the class in a limited time. Welding is dangerous for beginners and the welding environments are harmful and injurious to the health. In this paper, we introduce Mobile Arc Welding Learning (MAWL) app, a new approach for learning arc welding that incorporates mobile technology and enhanced with augmented reality (AR). The aim of this app is to enhance the contents used in arc welding learning materials used in the conventional learning by visualizing the information through the use of text, images, videos and 3D models. The MAWL app covers topics related to safety in welding, components of welding and steps in welding. The students can use the app to learn about welding on their own anytime and anywhere. The potential of using the MAWL app for welding learning among the polytechnic students has been investigated, specifically focusing on ease of use, learnability, satisfaction, usefulness, motivation and engagement. The results of the evaluation indicate that the users strongly agreed on ease of use, learnability, satisfaction, usefulness and motivation, while they agreed on engagement. These prove that the MAWL app has the potential to contribute to students welding learning through interactive and accessible information that satisfies them."
746,Diagnosing Adoption to Mobile Learning,"This study was undertaken to address the need to modernize the modes of teaching and learning pedagogy by taking advantage of the proliferation of electronic gadgets and mobile devices since, as counted there are more computers than the people in the world (Boren, 2014). This research found out how learning in the new platform could be adopted by teachers and students. In addition, it tested the different variables involved in the use of mobile in learning by faculty and students of Centro Escolar University (CEU) to determine factors that made implementing technology a success or a failure.To attain the set objectives, this study made use of descriptive and inferential method to the data gathered from respondents via stratified random sampling. Specifically, it employed frequency, mean, standard deviation, t-test, analysis of variance and multiple linear regressions for the treatment of data derived from the survey questionnaires. To complete the triangulation approach and for consistency of findings, observation and interview were also conducted.Subsequently, in order to determine adoption to mobile learning the modified Unified Theory of Acceptance and Use of Technology (UTAUT) model was employed. This model shows relationship of moderating variables which are age, gender, voluntariness of use and experience from independent variables like performance expectancy, effort expectancy, social influence, facilitating conditions, anxiety and self-efficacy. After all the statistical treatments were applied, Anxiety, Self-Efficacy, Effort Expectancy, Performance Expectancy and Facilitating Condition contribute to the success of the introduction of technology to the organization, while social influence was excluded as the reasons why users adopt it.,"
750,User-Centred Design in Content Management System Development: The Case of EMasters,"Including users in design and development of an interactive product is crucial to achieve high level of usability. Content management systems have two categories of users, content creators and content consumers, and designers of these systems have to considers the needs of both user groups. In design of interactive learning systems, special attention has to be given to the process of learning, which means that functional, accessible and usable interface has to serve the purpose of knowledge acquisition. Designing for mobile learning brings additional challenges due to the small screens of mobile devices. The paper describes the process of utilization of user-centred design in development of a simple content management system for learning called EMasters. The aim of the EMasters is to enable teachers to easily create and organize courses which will be delivered to students to facilitate web-based and mobile learning. According to the user-centred design approach, teachers and students are involved in iterative process of design, implementation and evaluation of EMasters. Evaluation study used complementary methods and provided quantitative and qualitative feedback. The usability score reached good level and the guidelines for redesign of the system interface are drown. According to the obtained results, proposed framework is confirmed to be applicable in user-centred design of content management systems in general. In addition, the directions for adjustment of the framework for specific cases are provided."
817,Motivation of Parents Towards Reading Multilingual eBooks To Pre-School Children,"The use of mobile devices for language learning, under the Mobile Assisted Language Learning (MALL) has been found to motivate children to read digital print. However, parents need to be convinced of the benefits of this new technology-assisted learning method within a multilingual learning context. A case study was conducted to propose a MALL framework in which educators and parents created a shared meaningful learning environment to develop the childrens emergent multilingual literacy skills, using mobile devices installed with interactive multilingual eBooks. This paper reports the findings, specifically on the parents attitude and motivation towards reading multilingual eBooks with their children. A group of 25 multi-ethnic families, together with their 5-year-old children participated in this study. A mixed-method explanatory research design obtained parent's attitude and motivation from a questionnaire, interview, and feedback form. The results show a high level of parents acceptance toward reading eBook with their children. Parents attributed their positive attitude and motivation towards MALL to the use of the multimedia, multilingual, and mobile platform. The MALL framework was also found to encourage parents and other adults to scaffold the childrens multilingual skills development. However, there were also setbacks toward the use of eBook as some parents expressed a stronger preference for printed books and were concerned with health issues associated with the childrens eBook use. Areas for improvements and future research are also made in this paper."
9,Digital Comic Media for Teaching Secondary School Science,"The rapid development of science and technology in the 21st Century demands students (both school and university) to hold sufficient skills, including critical thinking and problem solving, to compete globally. Educational systems are responsible for promoting the skills through the teaching and learning experiences, including teaching material and learning media applied in the class. This paper highlights the development of mobile apps-based digital comic media in social learning that can be integrated into personalized online learning. The steps to develop the media was applied the Gay's procedure. The digital comic media present an interactive science knowledge platform in the form of digital comic media enriched with Augmented reality technology. The media has been tested to 20 students during the emerging of the Covid-19 pandemic and showing good acceptance. This implies that digital comic media is of value to be used and applied in online learning.,"
23,Mobile Augmented Reality Learning Media with Metaverse to Improve Student Learning Outcomes in Science Class,"The development of information and communication technology affects the learning methods and media used. Augmented Reality technology allows students to experience learning with objects that can be seen in person. The purpose of the study was to see how students learned when they used the metaverse app, which is mobile augmented reality software for science courses. The population group consists of 92 students from several schools in cluster I, Depok Subdistrict. Then the sample was taken using the slovin formula until it obtained 75 samples of grade 5 students. This study employs experimental research techniques and a single group pre- and post-test. A t-test is used to analysed the collected data. According to the findings, using that metaverse applications has a favourable impact on students' learning outcomes. Students can use the Metaverse app to see better learning outcomes. Students are also more interested in learning and can easily understand and discover what is being learned. In addition, students find it more fun to learn using the Metaverse app, which is a mobile augmented reality."
32,Hi World: The Virtual Book Learning Integrated Augmented Reality to Increase Knowledge of Covid-19 Prevention in The Learning Process Post-Pandemic Era,"This research aims to Improve innovation Hi World integrated with AR, Testing The level of attraction of  Hi World, and test the level of Hi World's appropriateness for covid-19 patients. This research method is R&D involving the expert of Covid-19 and digital media. The result from this research are: Innovation of Hi World improved to have a good level of appropriateness with a score of  90%; Level of attraction with this book is good with a score of  95%, and Hi world have design choices that are suitable for the requirement that covid-19 patients needs"
38,Investigating the Potential of Integrating Augmented Reality into the 6E Instructional 3D Geometry Model in Fostering Students 3D Geometric Thinking Processes,"Schools as a source of knowledge need to facilitate the 3D geometric thinking process involving a series of cognitive action. Therefore, this research investigates the potential of integrating augmented reality (AR) into the 6E instructional 3D geometric model (6E I3DGM). This is an exploratory research carried out with a teacher and 28 junior high school students in Indramayu District, Indonesia. The data were collected through observations and interviews and examined, selected, extracted, and coded based on the criteria determined. The data collected were further interpreted and concluded, and descriptively analyzed using content analysis. The result showed that learning that integrates AR into 6E I3DGM has the ability to raise 3D geometric thinking processes in the dimensions of representation, spatial structuring, and measurement. This is because the use of AR can characteristically help students represent, construct nets, visualize the structure of 3D shapes, and assist in measuring the surface area and volume of 3D geometry. Moreover, it also facilitates students in constructing knowledge through a series of 3D geometric thinking activities. Therefore, the use of learning that integrates AR into 6E I3DGM has the potential to be an alternative for learning 3D geometry both during and after the COVID-19 pandemic.,"
50,Applying Augmented Reality to Chinese Radicals Learning: A Remedial Teaching Experiment in an Elementary School,"In the regions of Chinese as the first language, children with backward Chinese characters ability are more likely to give up reading the subject content of long texts, which affects their learning in the long term. This study applies augmented reality (AR) to develop a remedial teaching model for Chinese radical recognition and assesses its effectiveness on underachieved students at an elementary school. Based on several Chinese characters that were easy for children to confuse radicals, an AR app for Android was developed and installed in tablet computers. The remedial teaching model involves students to use AR app to scan radical cards and trigger animations introducing the evolution of radicals. Students can practice Chinese character writing on the tablet computer's screen. With the multiple stimulus of AR, the teacher lead students collaboratively complete the worksheets. To assess students' learning outcomes, a quasi-experimental approach was administrated to 8 second grade students who had backward Chinese literacy, in which qualitative and quantitative data were collected. Results showed this remedial teaching model improved the disadvantaged students recognition accuracy on Chinese characters and flips their motivation toward Chinese characters learning. During the remedial teaching program, use of AR was effective to get students more attentions and impressions on Chinese radicals. Finally, Implications for Chinese characters teaching practices are discussed"
54,Development of a Mobile e-Learning Platform on Physics Using Augmented Reality Technology,"With the constant increase of computing power in mobile devices (tablets, smartphones), new prospects have opened up for their application, in particular, in trade, industry, medicine, education, etc. In the field of education, mobile devices have a high potential, which, if properly integrated, can form a new effective learning model. This article is devoted to the development of a mobile application for a multilingual (Kazakh, Russian, English) educational platform for distance learning of physics in higher and secondary educational institutions using augmented reality technology.,"
46,Low-Cost and Energy-Efficient Alternatives for Home Automation using IoT,"Due to the COVID-19 pandemic, the world's population has undergone different changes in which an impact on the use of the internet stands out from daily aspects such as education, commerce, health, among others; which has made us highly dependent on its usage. In this regard, the term Internet of Things (IoT) has been increasingly recognized for its contribution to improving people's life quality, through objects that are integrated and connected to the Internet. This document aims to introduce alternatives for IoT-based home automation making use of NodeMCU, Sinric Pro, and smart voice assistants such as Google Home and Alexa. The proposals are efficient in terms of easy implementation and reduce electricity consumption by around 30%. This document is research that helps families improve their energy efficiency and daily productivity through IoT."
51,WoT Search Engine based on Multi Agent System: A Conceptual Framework,"The rising incursions with embed and linked sensors cause the construction of the Internet of Things (IoT). Its presenting a wide access to the physical world. We support that on head of this data, a Web of Things (WoT) is required. A framework that permits the achievement of programs related to sensors in the IoT. In this paper we present a conceptual model that describes Web of Things Search engine (WoTSE).Our WoTSE is based on artificial multi agent system with a modular architecture, addressing the key challenge of scalable search for rapidly changing content while leveraging existing Web infrastructure. Also, a model for searching in the WoT, namely WoTmAS2E, is proposed and experimentally evaluated using a prototype."
59,Critical Factors Influencing Pre-Service Teachers Use of the Internet of Things (IoT) in Classrooms,"This This study aims to explore the factors that influence pre-service teachers' decisions to use the Internet of Things (IoT) in a classroom setting as a digital system to enhance their teaching and learning. To achieve this aim, the technology acceptance model (TAM) is used to investigate the effects of using the IoT in an e-learning environment on pre-service teachers perceived usefulness, perceived ease of use, attitudes toward using IoT, and the influence of such attitudes on students behavior. Forty-seven final-year pre-service teaching students were selected to participate by purposeful sampling. A quantitative approach via regression analysis was conducted to analyze the collected data. The results showed that the TAM-related factors of perceived usefulness and perceived ease of use significantly contributed to pre-service teachers intentions to use the IoT in classrooms. However, their intention to use the IoT was not influenced by their attitude toward it. Implications and recommendations for future work are suggested as a result of this study."
