,article_title,abstract
1206,Virtual Reality Mobile Application Development with Scrum Framework as a New Media in Learning English,"Virtual reality is a combination of technology that are used to visualize and provide interaction with virtual environment. These environment often depict three-dimensional space which could be realistic or imaginary. One of the problem to build a virtual reality application is not yet available an approach as development lifecycle to build this virtual reality application. In this study we implement a software development project management approach which is Scrum to build a virtual reality application to be a new media for learning English. The goal is to find out how this system development approach is providing a new guide as a project management to build virtual reality application right from the project started, until the application is reach production stage or final release. Also in this study we using the unity 3D to create the virtual environment and C# as the backend programming language to build a mobile application which is made this virtual application is build using cross platform mobile development. The study concludes that mobile learning applications increase student motivation and place students as the main subject in English Lessons to support the teaching and learning process in an educational context."
1219,Usability Evaluation and User Acceptance of Mobile Applications for Saudi Autistic Children,"The evolution of mobile technologies in learning, has been increased the requirements for developing appropriate usability model to fall into the same line with mobile learning applications. Usability of mobile learning applications is a topic that is into research, this paper focuses a tailored designed model called (M-UTUAT) mobile usability model that combines People at the Centre of Mobile Application Development (PACMAD) and the unified theory of acceptance and use of technology (UTAUT) to form a more robust model. As an addition to the usability research, an application (ICT) was developed for children with speech delays and children diagnosed with autism spectrum. The application is a mobile/tablet-based application that developed according to mobile usability measures to get the maximum learning skills and abilities to help autistic children. It has been designed according to the needs of the children specific to their category and skills. The autism spectrum is a broad spectrum with high and low disabilities. The application consists of both visual and audio aids to help children feel comfortable and associate objects more easily with their original meaning and connections. (PECS) is one of the most common techniques that have been clinically proven to be effective in such cases. This application helped an individual with autism spectrum as well as children with speech delays or disabilities to communicate and correlate faster and easily. The application can help so many families by constructing a more communicative path for people with disabilities. The application is innovative that it developed in the Arabic language to serve Arabic learners as most of the autistic applications available serve English learners. Results gathered after questionnaire highlight the usability issues with the (ICT) application. We developed an app to overcome usability issues.,"
112,Analyzing Graduation Project Ideas by using Machine Learning,"The graduation projects (GP) are important because it reflects the academic profile and achievement of the students. For many years graduation projects are done by the information technology department students. Most of these projects have great value, and some were published in scientific journals and international conferences. However, these projects are stored in an archive room haphazardly and there is a very small part of it is a set of electronic PDF files stored on hard disk, which wastes time and effort and cannot benefit from it. However, there is no system to classify and store these projects in a good way that can benefit from them. In this paper, we reviewed some of the best machine learning algorithms to classify text “graduation projects”, support vector machine (SVM) algorithm, logistic regression (LR) algorithm, random forest (RF) algorithm, which can deal with an extremely small amount of dataset after comparing these algorithms based on accuracy. We choose the SVM algorithm to classify the projects. Besides, we will mention how to deal with a super small dataset and solve this problem."
904,Survey on Applications of Deep Learning and Machine Learning Techniques for Cyber Security,"The research aimed to conduct an extensive study of machine learning and deep learning methods in cybersecurity. To accomplish the objectives, the research carried out a qualitative study based on secondary data collection to review the available studies and literature. The research has examined three machine learning methods and three deep learning methods to study the most popular techniques used in cybersecurity. During the research, the working mechanism of each method was studied along with their strengths and weaknesses. Also, a comparative discussion has been made to examine the most effective method for cybersecurity. Limitations in the current literature were also identified, and future direction is also given to target and develop the weak areas of machine learning and deep learning methods.,"
1247,Credit Card Fraud Detection Using Fuzzy Rough Nearest Neighbor and Sequential Minimal Optimization with Logistic Regression,"The global online communication channel made possible with the internet has increased credit card fraud leading to huge loss of monetary fund in their billions annually for consumers and financial institutions. The fraudsters constantly devise new strategy to perpetrate illegal transactions. As such, innovative detection systems in combating fraud are imperative to curb these losses. This paper presents the combination of multiple classifiers through stacking ensemble technique for credit card fraud detection. The fuzzy-rough nearest neighbor (FRNN) and sequential minimal optimization (SMO) are employed as base classifiers. Their combined prediction becomes data input for the meta-classifier, which is logistic regression (LR) resulting in a final predictive outcome for improved detection. Simulation results compared with seven other algorithms affirms that ensemble model can adequately detect credit card fraud with detection rates of 84.90% and 76.30%.,"
188,Using Machine Learning via Deep Learning Algorithms to Diagnose the Lung Disease Based on Chest Imaging: A Survey," Chest imaging diagnostics is crucial in the medical area due to many serious lung diseases like cancers and nodules and particularly with the current pandemic of Covid-19. Machine learning approaches yield prominent results toward the task of diagnosis. Recently, deep learning methods are utilized and recommended by many studies in this domain. The research aims to critically examine the newest lung disease detection procedures using deep learning algorithms that use X-ray and CT scan datasets. Here, the most recent studies in this area (2015-2021) have been reviewed and summarized to provide an overview of the most appropriate methods that should be used or developed in future works, what limitations should be considered, and at what level these techniques help physicians in identifying the disease with better accuracy. The lack of various standard datasets, the huge training set, the high dimensionality of data, and the independence of features have been the main limitations based on the literature. However, different architectures of deep learning are used by many researchers but, Convolutional Neural Networks (CNN) are still state-of-art techniques in dealing with image datasets.,"
693,Phishing Detection Based on Machine Learning and Feature Selection Methods,"With increasing technology developments, the Internet has become everywhere and accessible by everyone. There are a considerable number of web-pages with different benefits. Despite this enormous number, not all of these sites are legitimate. There are so-called phishing sites that deceive users into serving their interests. This paper dealt with this problem using machine learning algorithms in addition to employing a novel dataset that related to phishing detection, which contains 5000 legitimate web-pages and 5000 phishing ones. In order to obtain the best results, various machine learning algorithms were tested. Then J48, Random forest, and Multilayer perceptron were chosen. Different feature selection tools were employed to the dataset in order to improve the efficiency of the models. The best result of the experiment achieved by utilizing 20 features out of 48 features and applying it to Random forest algorithm. The accuracy was 98.11%."
1014,Optimizing Android Malware Detection Via Ensemble Learning,"Android operating system has become very popular, with the highest market share, amongst all other mobile operating systems due to its open source nature and users friendliness. This has brought about an uncontrolled rise in malicious applications targeting the Android platform. Emerging trends of Android malware are employing highly sophisticated detection and analysis avoidance techniques such that the traditional signature-based detection methods have become less potent in their ability to detect new and unknown malware. Alternative approaches, such as the Machine learning techniques have taken the lead for timely zero-day anomaly detections.  The study aimed at developing an optimized Android malware detection model using ensemble learning technique. Random Forest, Support Vector Machine, and k-Nearest Neighbours were used to develop three distinct base models and their predictive results were further combined using Majority Vote combination function to produce an ensemble model. Reverse engineering procedure was employed to extract static features from large repository of malware samples and benign applications. WEKA 3.8.2 data mining suite was used to perform all the learning experiments. The results showed that Random Forest had a true positive rate of 97.9%, a false positive rate of 1.9% and was able to correctly classify instances with 98%, making it a strong base model. The ensemble model had a true positive rate of 98.1%, false positive rate of 1.8% and was able to correctly classify instances with 98.16%. The finding shows that, although the base learners had good detection results, the ensemble learner produced a better optimized detection model compared with the performances of those of the base learners.,"
1163,Fog Computing Based on Machine Learning: A Review,"Internet of Things (IoT) systems usually produce massive amounts of data, while the number of devices connected to the internet might reach billions by now. Sending all this data over the internet will overhead the cloud and consume bandwidth. Fog computing's (FC) promising technology can solve the issue of computing and networking bottlenecks in large-scale IoT applications. This technology complements the cloud computing by providing processing power and storage to the edge of the network. However, it still suffers from performance and security issues. Thus, machine learning (ML) attracts attention for enabling FC to settle its issues. Lately, there has been a growing trend in utilizing ML to improve FC applications, like resource management, security, lessen latency and power usage. Also, intelligent FC was studied to address issues in industry 4.0, bioinformatics, blockchain and vehicular communication system. Due to the ML vital role in the FC paradigm, this work will shed light on recent studies utilized ML in a FC environment. Background knowledge about ML and FC also presented. This paper categorized the surveyed studies into three groups according to the aim of ML implementation. These studies were thoroughly reviewed and compared using sum-up tables. The results showed that not all studies used the same performance metric except those worked on security issues. In conclusion, the simulations of proposed ML models are not sufficient due to the heterogeneous nature of the FC paradigm.,"
98,Leveraging Smartphone Sensors for Detecting Abnormal Gait for Smart Wearable Mobile Technologies,"Walking is one of the most common modes of terrestrial locomotion for humans. Walking is essential for humans to perform most kinds of daily activities. When a person walks, there is a pattern in it, and it is known as gait. Gait analysis is used in sports and healthcare. We can analyze this gait in different ways, like using video captured by the surveillance cameras or depth image cameras in the lab environment. It also can be recognized by wearable sensors. e.g., accelerometer, force sensors, gyroscope, flexible goniometer, magneto resistive sensors, electromagnetic tracking system, force sensors, and electromyography (EMG). Analysis through these sensors required a lab condition, or users must wear these sensors. For detecting abnormality in gait action of a human, we need to incorporate the sensors separately. We can know about one's health condition by abnormal human gait after detecting it. Understanding a regular gait vs. abnormal gait may give insights to the health condition of the subject using the smart wearable technologies. Therefore, in this paper, we proposed a way to analyze abnormal human gait through smartphone sensors. Though smart devices like smartphones and smartwatches are used by most of the person nowadays. So, we can track down their gait using sensors of these intelligent wearable devices. In this study, we used twenty-three () people to record their walking activities. Among them fourteen people have normal gait actions, and nine people were facing difficulties with their walking due to their illness. To do the stratification of the gait of the subjects, we have adopted five machine learning algorithms with addition a deep learning algorithm. The advantages of the traditional classification are analyzed and compared among themselves. After rigorous performance analysis we found support vector machine (SVM) showing 96% accuracy, highest among the tradition classifiers. 70%, 84%, and 95% accuracy is obtained by the logistic regression, Naïve Bayes, and k-Nearest Neighbor (kNN) classifiers, respectively. As per the state-of-the art, deep learning classifiers has been proven to outperform the traditional classifiers in similar binary classification problems. We have considered the scenario and applied the 2D convolutional neural network (2D-CNN) classification algorithm, which outperformed the other algorithms showing accuracy of 98%. The model can be optimized and can be integrated with the other sensors to be utilized in the mobile wearable devices.,"
175,Leveraging Sensor Fusion and Sensor-Body Position for Activity Recognition for Wearable Mobile Technologies,"Smart devices like smartphones and smartwatches have made this world smarter. These wearable devices are created through complex research methodologies to make them more usable and interactive with its user. Various interactive mobile applications such as augmented reality (AR), virtual reality (VR) or mixed reality (MR) applications solely depend on the in-built sensors of the smart devices. A lot of facilities can be taken from these devices with sensors such as accelerometer and gyroscope. Different physical activities such as walking, jogging, sitting, etc., can be important for analysis like health state prediction and duration of exercise by using those sensors based on artificial intelligence. In this paper, we have implemented machine learning and deep learning algorithms to detect and recognize eight activities namely, walking, jogging, standing, walking upstairs, walking downstairs, sitting, sitting-in-a-car and cycling; with a maximum of 99.3% accuracy. A few activities are almost similar in action, such as sitting and sitting-in-a-car, but difficult to distinguish; which makes it more challenging to predict tasks. In this paper, we have hypothesized that with more sensors (sensor fusion) and data collection points (sensor-body positions) a wide range of activities can be recognized and the recognition accuracies can be increased. Finally, we showed that the combination of all the sensors data of both pocket/waist and wrist can be used to recognize a wide range of activities accurately. The possibility of using the proposed methodologies for futuristic mobile technologies is quite significant. The adaptation of most recent deep learning algorithms such as convolutional neural network (CNN) and bi-directional Long Short Time Memory (Bi-LSTM) demonstrated high credibility of the methods presented as experimentation.,"
1028,A Comparative Study of Machine Learning Methods for Automatic Classification of Academic and Vocational Guidance Questions,"Academic and vocational guidance is a particularly important issue today, as it strongly determines the chances of successful integration into the labor market, which has become increasingly difficult. Families have understood this because they are interested, often with concern, in the orientation of their child. In this context, it is very important to consider the interests, trades, skills, and personality of each student to make the right decision and build a strong career path. This paper deals with the problematic of educational and vocational guidance by providing a comparative study of the results of four machine-learning algorithms. The algorithms we used are for the automatic classification of school orientation questions and four categories based on John L. Holland's Theory of RIASEC typology. The results of this study show that neural networks work better than the other three algorithms in terms of the automatic classification of these questions. In this sense, our model allows us to automatically generate questions in this domain. This model can serve practitioners and researchers in E-Orientation for further research because the algorithms give us good results."
10,Shared Nearest Neighbour in Text Mining for Classification Material in Online Learning Using Mobile Application,"There are many resources for media learning in online learning that all of the teachers made many media which it made a problem if there have the same subject and material. This problem made online learning having a big database and many materials made useless because the material has the same purpose. The big problem in overload database is that online learning can't be accessed by everyone. This research to fix this problem developed an algorithm in Artificial Intelligence for the classification of material in online learning with the same subject and purpose so that teachers can use already media. This algorithm is text mining and Shared Nearest Neighbour (SSN) that is embedded in the mobile application to display the classification and the location of searching media in database online learning. The testing in this research  applied in 142 media  with 130 data training and 12 data testing is  the result of testing is 94,7% of the accuracy of the algorithm  and The average of validation is 73,33%.,"
86,Machine Learning Models to Predict Students Study Path Selection,"Selecting a proper study path in higher education is a difficult task for many students. They either have a lack of knowledge on the study path offered or are unsure of their interest in the various options. The current educational setups enable us to collect valid and reliable data on student success and learning behaviour. This study explores and solves the problem of what path to select by proposing possible study paths with the help of machine learning algorithms.  Learning analytics (LA) and educational data mining (EDM) are technologies that aid in the analysis of educational data. In this quantitative study, we applied a questionnaire to collect data from students at the Business Information Technology Department (Bite) at the Haaga-Helia University of Applied Science. We managed to collect 101 samples from students during 2017–2018. We used various machine learning algorithms and prediction models to assess the best approach for study path selection.  We applied three performance scores of accuracy, Cohens Kappa, and ROC curve to measure the accuracy of the algorithm results. KNIME analytics was selected as a proper tool to pre-process, prepare, analyse, and model the data. The results indicate that Random Forest (94% accuracy) and Decision Tree (93% accuracy) are the best classification models for students study path selection. The contribution of this study is for educational data mining research to assess the comparison of various algorithms. Furthermore, this is a novel approach to predict students study path selection, which educational institutes should develop to assist students in their study path selection."
109,Identification of Fraud Apps Using Sentiment Analysis Techniques,"Considering that applications security is an important aspect, especially nowadays with the increase in technology and the number of fraudsters. It should be noted that determining the security of an application is a difficult task, especially since most fraudsters have become skilled and professional at manipulating people and stealing their sensitive data. Therefore, we pay attention to spot insecure apps by analyzing user feedback on Google Play platform using sentiment analysis. As it is known, user reviews reflect their experiments and experiences in addition to their feelings and satisfaction with the application. But unfortunately, not all of these reviews are real, fake reviews do not reflect the sincerity of feelings, so we have been keen in our work to filter the reviews and deliver accurate and correct results. This tool is useful for both users wanting to install an android app and for developers interested in apps optimization."
111,The Impact of Using Blackboard on Students Grades,"The Learning Management System (LMS) is a core system that contributes to support e-learning, managing content, provide learning tools, and facilitate communication between students and teachers. This project aims to measure the impact of Blackboard-based e-learning use. We measure the effect of blackboard use on male students by comparing male and female students degrees of online learning (online class preparation) and traditional (face-to-face) learning at Qassim University, using statistical methods and data mining algorithms. We also develop A supportive tool that helps teachers manage some important tasks such as (student attendance, interaction, grades ... etc.). This tool will take student information and push automatic notifications to all concerned people via SMS."
130,Application for Identifying Students Achievement Prediction Model in Tertiary Education: Learning Strategies for Lifelong Learning,"The purpose of the research is to identify the risk of dropping out in tertiary students with an application. The components of the research goal aim (1) to develop the students achievement prediction model and (2) to construct a prototype application for the predictions of the tertiary students dropping out. The research tools consisted of three parts, (1) tool for developing predictive prototypes uses a tool called the CRISP-DM process with Decision Tree Classification, Feature Selection methods, Confusion Matrix performance, Cross-Validation methods, Accuracy, Precision and Recall measurements, (2) tool for application development used the SDLC with V-method, and (3) tool to assess application satisfaction used questionnaires and statistical analysis. Data sample were collected from 401 students enrolled in the Business Computer Program at the School of Information and Communication Technology, University of Phayao during the academic year 2012-2016. The results showed that the prediction model had a very high percentage of accuracy (82.29%). The prototype test results with the data gathered had a very high score level (84.04%; correct 337 out of 401 training examples). An overview of the underlying application with the utmost integrity by the researchers planned to put the application to the test in the first semester of the academic year 2021 at the School of Information Technology and Communication, University of Phayao. For future research, the researchers plan to create a mobile application for mentors in the University of Phayao to monitor learner on both Android and iOS systems."
320,Network Proximity for Content Discovery,"The paper describes our approach for using wireless sensors on mobile phones for delivering new data to mobile subscribers. We propose a new practical approach for social context-aware data retrieval based on mobile phones as a sensor concept. This approach uses Wi-Fi and Bluetooth modules located on mobile phones as sensors for getting proximity information that can open (discover) access to any user generated content or content published in the social networks. A special mobile service (context-aware browser client for Android) can present that information to mobile subscribers. The potential use-cases for the proposed approach include all projects associated with hyper-local news data. For example, news services in Smart City projects, proximity marketing, indoor data delivery, etc."
